{"run":104,"commit":"28dff2e","metric":-84.071696,"metrics":{"delta_p25_us":-95.522,"delta_p75_us":-68.476915,"delta_iqr_us":27.045085,"delta_empty_us":-90.856337,"delta_two_entry_us":-83.930664,"delta_disabled_us":-77.268446,"delta_hourly_us":-70.296224,"ct_startup_us":397.428223,"minimal_startup_us":480.233778,"startup_ratio_x":0.827572,"ct_resolve_us":0.066409,"minimal_resolve_us":0.159666,"resolve_delta_us":-0.093256,"ct_apply_us":565.45469,"minimal_apply_us":561.150522,"apply_delta_us":-1.407705,"apply_delta_p25_us":-9.237185,"apply_delta_p75_us":8.549688,"apply_delta_iqr_us":17.786873,"apply_delta_empty_us":-0.22583,"apply_delta_two_entry_us":6.20042,"apply_delta_disabled_us":-3.19375,"apply_delta_hourly_us":6.73208,"command_us":59.291504},"status":"keep","description":"No-code confirmation with per-scenario diagnostics","timestamp":1777132381665,"segment":14,"confidence":null,"iterationTokens":2119,"asi":{"hypothesis":"Confirm current benchmark after adding per-scenario startup/apply diagnostics and capture noise envelope with all diagnostic metrics present.","result":"delta_us confirmed near prior diagnostic run (-84.07us vs -84.13us). Scenario startup deltas remained all faster than minimal; apply scenario deltas remained within apply IQR. Current benchmark runtime roughly doubled but stays acceptable.","next_action_hint":"Use these diagnostics as decision support only. No scenario-specific production optimization is justified unless repeated gains exceed measured IQR."}}
{"run":105,"commit":"4adcd65","metric":-83.709554,"metrics":{"delta_p25_us":-102.099582,"delta_p75_us":-63.02322,"delta_iqr_us":39.076362,"delta_empty_us":-81.523003,"delta_two_entry_us":-77.824002,"delta_disabled_us":-86.143555,"delta_hourly_us":-70.342773,"ct_startup_us":406.526693,"minimal_startup_us":492.188694,"startup_ratio_x":0.825957,"ct_resolve_us":0.044185,"minimal_resolve_us":0.065095,"resolve_delta_us":-0.020909,"ct_apply_us":561.454688,"minimal_apply_us":558.197292,"apply_delta_us":2.383335,"apply_delta_p25_us":-3.707505,"apply_delta_p75_us":10.367292,"apply_delta_iqr_us":14.074797,"apply_delta_empty_us":2.74249,"apply_delta_two_entry_us":5.25916,"apply_delta_disabled_us":0.865,"apply_delta_hourly_us":5.60666,"command_us":61.725195},"status":"keep","description":"Reuse paired samples for per-scenario diagnostics","timestamp":1777132549396,"segment":14,"confidence":null,"iterationTokens":9113,"asi":{"hypothesis":"Per-scenario diagnostics can be computed from the existing paired aggregate startup/apply samples instead of separate diagnostic passes, preserving metrics while reducing benchmark runtime and duplication.","result":"Benchmark runtime returned to ~17s from ~34s while keeping all diagnostics. Primary delta_us stayed in the same noisy band at -83.71us; scenario metrics remain useful and apply scenario deltas stay within IQR.","benchmark_change":"Diagnostic computation refactored only; primary workload and metric names unchanged.","next_action_hint":"Keep this benchmark refactor. Run one no-code confirmation if continuing benchmark work; production micro-opts remain unjustified."}}
{"run":106,"commit":"4adcd65","metric":-67.328722,"metrics":{"delta_p25_us":-80.277669,"delta_p75_us":-50.056641,"delta_iqr_us":30.221029,"delta_empty_us":-78.240343,"delta_two_entry_us":-67.768446,"delta_disabled_us":-75.930664,"delta_hourly_us":-52.296332,"ct_startup_us":417.447971,"minimal_startup_us":483.766113,"startup_ratio_x":0.862913,"ct_resolve_us":0.039324,"minimal_resolve_us":0.051979,"resolve_delta_us":-0.012654,"ct_apply_us":563.12521,"minimal_apply_us":562.24677,"apply_delta_us":-1.020105,"apply_delta_p25_us":-11.733125,"apply_delta_p75_us":5.437915,"apply_delta_iqr_us":17.17104,"apply_delta_empty_us":1.12708,"apply_delta_two_entry_us":-4.28583,"apply_delta_disabled_us":-8.76875,"apply_delta_hourly_us":9.06458,"command_us":57.741699},"status":"discard","description":"No-code confirmation after reusing samples for diagnostics","timestamp":1777132585267,"segment":14,"confidence":null,"iterationTokens":1867,"asi":{"hypothesis":"Confirm the benchmark refactor that reuses paired samples for per-scenario diagnostics.","rollback_reason":"No code change was made and delta_us reran worse at -67.33us, but all scenario startup deltas still showed Colorful Times faster than minimal and apply scenario deltas stayed within IQR. This confirms noise, not a reason to revert the benchmark refactor.","next_action_hint":"Keep the refactor for runtime and diagnostic quality. Production optimization should stop unless a new structural idea appears."}}
{"run":107,"commit":"f8f5c41","metric":-74.978027,"metrics":{"delta_p25_us":-88.375109,"delta_p75_us":-55.836833,"delta_iqr_us":32.538276,"delta_empty_us":-93.111003,"delta_two_entry_us":-81.370551,"delta_disabled_us":-90.097114,"delta_hourly_us":-48.921332,"ct_startup_us":416.064887,"minimal_startup_us":486.292806,"startup_ratio_x":0.855585,"ct_resolve_us":0.038722,"minimal_resolve_us":0.04702,"resolve_delta_us":-0.008298,"ct_apply_us":551.991145,"minimal_apply_us":546.888958,"apply_delta_us":3.52229,"apply_delta_p25_us":0.23854,"apply_delta_p75_us":9.442705,"apply_delta_iqr_us":9.204165,"apply_delta_empty_us":1.82707,"apply_delta_two_entry_us":2.72541,"apply_delta_disabled_us":2.32125,"apply_delta_hourly_us":9.84375,"command_us":57.325098,"command_p25_us":56.049902,"command_p75_us":60.825,"command_iqr_us":4.775098},"status":"keep","description":"Report command registration spread diagnostics","timestamp":1777132659687,"segment":14,"confidence":null,"iterationTokens":3425,"asi":{"hypothesis":"Adding command p25/p75/IQR diagnostics will prevent overfitting future command registration tweaks below measured command noise.","result":"Benchmark now reports command_iqr_us=4.78us with command_us=57.33us. This confirms previous sub-2us command changes were below noise.","benchmark_change":"Diagnostic-only command spread metrics added; primary delta_us and workload unchanged.","next_action_hint":"Avoid command path work unless it improves by much more than ~5us repeatedly."}}
{"run":108,"commit":"5814b0c","metric":-84.700277,"metrics":{"delta_p25_us":-96.180664,"delta_p75_us":-62.513916,"delta_iqr_us":33.666748,"delta_empty_us":-99.499891,"delta_two_entry_us":-81.833225,"delta_disabled_us":-78.93023,"delta_hourly_us":-74.652886,"ct_startup_us":394.618083,"minimal_startup_us":480.0185,"startup_ratio_x":0.822089,"ct_resolve_us":0.050399,"minimal_resolve_us":0.103159,"resolve_delta_us":-0.05276,"ct_apply_us":547.391667,"minimal_apply_us":545.818855,"apply_delta_us":1.811877,"apply_delta_p25_us":-0.970518,"apply_delta_p75_us":6.664583,"apply_delta_iqr_us":7.6351,"apply_delta_empty_us":1.78208,"apply_delta_two_entry_us":11.19834,"apply_delta_disabled_us":-4.36709,"apply_delta_hourly_us":5.48625,"command_us":60.004199,"command_p25_us":57.329102,"command_p75_us":63.949902,"command_iqr_us":6.620801},"status":"keep","description":"No-code confirmation with command spread diagnostics","timestamp":1777132719894,"segment":14,"confidence":null,"iterationTokens":2317,"asi":{"hypothesis":"Confirm current benchmark with command spread diagnostics and capture command noise envelope.","result":"delta_us stayed faster than minimal at -84.70us. command_iqr_us reran at 6.62us, reinforcing that small command changes should be ignored. Scenario startup deltas remain all faster than minimal.","next_action_hint":"No safe production optimizations remain under current workload; only benchmark diagnostics/quality changes are justified."}}
{"run":109,"commit":"421a4ee","metric":-80.368083,"metrics":{"delta_p25_us":-93.836914,"delta_p75_us":-48.665392,"delta_iqr_us":45.171522,"delta_empty_us":-92.861003,"delta_two_entry_us":-92.055556,"delta_disabled_us":-87.087999,"delta_hourly_us":-54.537109,"ct_startup_us":403.712999,"minimal_startup_us":483.393392,"startup_ratio_x":0.835164,"ct_resolve_us":0.04591,"minimal_resolve_us":0.070469,"resolve_delta_us":-0.024558,"ct_apply_us":546.894373,"minimal_apply_us":544.832083,"apply_delta_us":4.688022,"apply_delta_p25_us":-2.438542,"apply_delta_p75_us":10.377812,"apply_delta_iqr_us":12.816355,"apply_delta_empty_us":7.46292,"apply_delta_two_entry_us":10.40375,"apply_delta_disabled_us":-1.88249,"apply_delta_hourly_us":4.08167,"command_us":57.433398,"command_p25_us":56.249805,"command_p75_us":61.208301,"command_iqr_us":4.958496},"status":"keep","description":"Enforce minimal switcher under 50 lines in checks","timestamp":1777132851162,"segment":14,"confidence":null,"iterationTokens":19042,"asi":{"hypothesis":"Add a correctness/backpressure check that prevents weakening the benchmark reference by letting bench/minimal-switcher.lua grow beyond the stated under-50-line target.","result":"Checks passed with minimal-switcher.lua under 50 lines. Primary delta_us remained faster than minimal at -80.37us; metric impact is noise-only because production and benchmark workload did not change.","benchmark_change":"autoresearch.checks.sh now enforces the minimal reference line-count contract before running the test suite.","next_action_hint":"Keep this guard. Continue with benchmark integrity/diagnostic work only unless a new structural production idea appears."}}
{"run":110,"commit":"a66ffe0","metric":-73.519613,"metrics":{"delta_p25_us":-95.616835,"delta_p75_us":-61.724609,"delta_iqr_us":33.892225,"delta_empty_us":-93.245334,"delta_two_entry_us":-76.175781,"delta_disabled_us":-88.657444,"delta_hourly_us":-67.518555,"ct_startup_us":410.766249,"minimal_startup_us":489.609945,"startup_ratio_x":0.838966,"ct_resolve_us":0.051056,"minimal_resolve_us":0.089359,"resolve_delta_us":-0.038303,"ct_apply_us":553.278125,"minimal_apply_us":556.489167,"apply_delta_us":0.576667,"apply_delta_p25_us":-5.881772,"apply_delta_p75_us":5.088435,"apply_delta_iqr_us":10.970208,"apply_delta_empty_us":-8.55167,"apply_delta_two_entry_us":8.26208,"apply_delta_disabled_us":-0.105,"apply_delta_hourly_us":2.27583,"command_us":58.095898,"command_p25_us":55.679102,"command_p75_us":65.812402,"command_iqr_us":10.133301},"status":"keep","description":"Document benchmark diagnostic metrics","timestamp":1777132934328,"segment":14,"confidence":null,"iterationTokens":3449,"asi":{"hypothesis":"Document all benchmark diagnostic metrics in autoresearch.md so future experiment decisions use the spread/scenario data rather than overfitting single medians.","result":"Docs updated; checks passed. Primary delta_us stayed faster than minimal at -73.52us, and all scenario startup deltas remained negative. No production code changed.","benchmark_change":"Documentation-only update for diagnostic metric interpretation.","next_action_hint":"Use documented IQR metrics as stop/go criteria; only pursue changes with repeated gains well above IQR or clear maintainability benefits."}}
{"run":111,"commit":"127164e","metric":-82.832194,"metrics":{"delta_p25_us":-88.884277,"delta_p75_us":-69.629693,"delta_iqr_us":19.254584,"delta_empty_us":-95.171332,"delta_two_entry_us":-82.764323,"delta_disabled_us":-84.180556,"delta_hourly_us":-64.879449,"ct_startup_us":379.717638,"minimal_startup_us":462.366889,"startup_ratio_x":0.821247,"ct_resolve_us":0.05227,"minimal_resolve_us":0.083829,"resolve_delta_us":-0.031559,"ct_apply_us":525.204585,"minimal_apply_us":524.962397,"apply_delta_us":2.17031,"apply_delta_p25_us":-1.946665,"apply_delta_p75_us":5.168123,"apply_delta_iqr_us":7.114788,"apply_delta_empty_us":-0.09709,"apply_delta_two_entry_us":4.5525,"apply_delta_disabled_us":-2.81083,"apply_delta_hourly_us":3.87875,"command_us":57.195898,"command_p25_us":56.033301,"command_p75_us":61.025195,"command_iqr_us":4.991895},"status":"keep","description":"Enforce minimal switcher independence in checks","timestamp":1777133006264,"segment":14,"confidence":null,"iterationTokens":2591,"asi":{"hypothesis":"Add a checks guard that prevents the minimal reference from requiring or referencing colorful-times, avoiding benchmark coupling or accidental cheating.","result":"Checks passed; minimal switcher remains independent. Primary delta_us stayed faster than minimal at -82.83us with all startup scenarios negative.","benchmark_change":"autoresearch.checks.sh now fails if bench/minimal-switcher.lua contains colorful-times.","next_action_hint":"Keep this guard. Continue only with benchmark integrity/diagnostic work unless a new structural production idea appears."}}
{"run":112,"commit":"7c2fc87","metric":-89.192139,"metrics":{"delta_p25_us":-92.629639,"delta_p75_us":-74.174696,"delta_iqr_us":18.454942,"delta_empty_us":-91.912001,"delta_two_entry_us":-95.587999,"delta_disabled_us":-89.801324,"delta_hourly_us":-77.453885,"ct_startup_us":367.722276,"minimal_startup_us":453.569444,"startup_ratio_x":0.81073,"ct_resolve_us":0.066176,"minimal_resolve_us":0.105207,"resolve_delta_us":-0.039032,"ct_apply_us":525.641975,"minimal_apply_us":522.748125,"apply_delta_us":0.799795,"apply_delta_p25_us":-2.746875,"apply_delta_p75_us":3.763018,"apply_delta_iqr_us":6.509893,"apply_delta_empty_us":0.79417,"apply_delta_two_entry_us":0.56083,"apply_delta_disabled_us":1.30042,"apply_delta_hourly_us":3.74375,"command_us":56.620801,"command_p25_us":55.987305,"command_p75_us":59.858496,"command_iqr_us":3.871191},"status":"keep","description":"No-code confirmation with minimal switcher integrity checks","timestamp":1777133078672,"segment":14,"confidence":null,"iterationTokens":2342,"asi":{"hypothesis":"Confirm current HEAD after minimal switcher line-count and independence checks were added.","result":"Checks passed and no-code confirmation measured delta_us=-89.19us. All scenario startup deltas remain negative; apply deltas are small and inside apply_iqr=6.51us; command_iqr=3.87us.","next_action_hint":"Integrity checks are confirmed. No production code change is justified without a new structural idea; continue with benchmark quality only if needed."}}
{"run":113,"commit":"07ce461","metric":-84.695692,"metrics":{"delta_p25_us":-100.027751,"delta_p75_us":-70.704861,"delta_iqr_us":29.32289,"delta_empty_us":-93.30089,"delta_two_entry_us":-93.07411,"delta_disabled_us":-98.060221,"delta_hourly_us":-78.166341,"ct_startup_us":377.897027,"minimal_startup_us":463.605279,"startup_ratio_x":0.815127,"ct_resolve_us":0.054724,"minimal_resolve_us":0.079897,"resolve_delta_us":-0.025172,"ct_apply_us":526.227395,"minimal_apply_us":522.980835,"apply_delta_us":2.00313,"apply_delta_p25_us":-2.013125,"apply_delta_p75_us":7.086458,"apply_delta_iqr_us":9.099583,"apply_delta_empty_us":3.14917,"apply_delta_two_entry_us":4.68041,"apply_delta_disabled_us":-0.65751,"apply_delta_hourly_us":5.48,"first_apply_delta_us":179.000244,"first_apply_delta_p25_us":152.1875,"first_apply_delta_p75_us":219.03125,"first_apply_delta_iqr_us":66.84375,"ct_first_apply_us":1023.125488,"minimal_first_apply_us":845.479248,"command_us":63.016602,"command_p25_us":59.970898,"command_p75_us":64.212402,"command_iqr_us":4.241504},"status":"keep","description":"Report cold first-apply spread diagnostics","timestamp":1777133286321,"segment":14,"confidence":null,"iterationTokens":27456,"asi":{"hypothesis":"Add cold first-apply diagnostics so the steady-state 100-iteration apply average does not hide one-time schedule preprocessing costs after setup.","result":"First-apply diagnostics show Colorful Times is about 179us slower than minimal on cold first apply, while steady-state apply remains within noise (apply_delta_us=2.00us). Startup still beats minimal in every scenario.","benchmark_change":"Diagnostic-only first_apply metrics added; primary delta_us and existing workload unchanged.","next_action_hint":"Do not optimize blindly yet. Confirm first_apply signal; if repeated, consider a separate metric/workload only if cold first switch matters to the product goal."}}
{"run":114,"commit":"61fafcd","metric":-90.902805,"metrics":{"delta_p25_us":-106.241889,"delta_p75_us":-79.716363,"delta_iqr_us":26.525526,"delta_empty_us":-85.495334,"delta_two_entry_us":-88.879666,"delta_disabled_us":-110.694661,"delta_hourly_us":-77.52322,"ct_startup_us":407.236138,"minimal_startup_us":497.919,"startup_ratio_x":0.817876,"ct_resolve_us":0.052195,"minimal_resolve_us":0.095801,"resolve_delta_us":-0.043606,"ct_apply_us":563.09771,"minimal_apply_us":557.584685,"apply_delta_us":1.586667,"apply_delta_p25_us":-1.024268,"apply_delta_p75_us":9.693958,"apply_delta_iqr_us":10.718225,"apply_delta_empty_us":6.4925,"apply_delta_two_entry_us":8.12166,"apply_delta_disabled_us":0.76167,"apply_delta_hourly_us":3.16707,"first_apply_delta_us":197.552246,"first_apply_delta_p25_us":98.416504,"first_apply_delta_p75_us":254.927002,"first_apply_delta_iqr_us":156.510498,"ct_first_apply_us":1037.52124,"minimal_first_apply_us":847.947998,"command_us":55.583301,"command_p25_us":54.804199,"command_p75_us":59.470703,"command_iqr_us":4.666504},"status":"keep","description":"No-code confirmation of cold first-apply diagnostics","timestamp":1777133386973,"segment":14,"confidence":null,"iterationTokens":2518,"asi":{"hypothesis":"Confirm the cold first-apply diagnostic signal before considering a new first-switch workload or optimization target.","result":"First-apply delta repeated at 197.55us, similar to the first run's 179.00us, but spread is high (IQR 156.51us). Startup remains faster than minimal in every scenario; steady-state apply remains within noise.","next_action_hint":"If user wants a new target, switch primary metric to first_apply_delta_us; otherwise keep it diagnostic only to avoid moving goalposts after parity was achieved."}}
{"run":115,"commit":"f63dab3","metric":-85.490723,"metrics":{"delta_p25_us":-100.317166,"delta_p75_us":-67.005724,"delta_iqr_us":33.311442,"delta_empty_us":-91.18967,"delta_two_entry_us":-86.393555,"delta_disabled_us":-77.300781,"delta_hourly_us":-72.286892,"ct_startup_us":405.101807,"minimal_startup_us":487.138862,"startup_ratio_x":0.831594,"ct_resolve_us":0.051787,"minimal_resolve_us":0.097488,"resolve_delta_us":-0.0457,"ct_apply_us":558.554272,"minimal_apply_us":556.853333,"apply_delta_us":2.83083,"apply_delta_p25_us":-1.027605,"apply_delta_p75_us":7.720417,"apply_delta_iqr_us":8.748022,"apply_delta_empty_us":5.4425,"apply_delta_two_entry_us":1.235,"apply_delta_disabled_us":-3.8575,"apply_delta_hourly_us":2.62166,"first_apply_delta_us":187.395996,"first_apply_delta_p25_us":130.937988,"first_apply_delta_p75_us":264.624756,"first_apply_delta_iqr_us":133.686768,"ct_first_apply_us":1047.739502,"minimal_first_apply_us":844.083252,"first_apply_delta_empty_us":134.333008,"first_apply_delta_two_entry_us":142.791992,"first_apply_delta_disabled_us":17.375977,"first_apply_delta_hourly_us":315.208008,"command_us":58.008301,"command_p25_us":55.125195,"command_p75_us":64.820898,"command_iqr_us":9.695703},"status":"keep","description":"Report per-scenario cold first-apply diagnostics","timestamp":1777133476965,"segment":14,"confidence":null,"iterationTokens":4430,"asi":{"hypothesis":"Per-scenario cold first-apply diagnostics can show whether the first-switch gap is broad or concentrated in the hourly schedule scenario.","result":"First-apply gap is largest for hourly schedule (315us), also visible for empty/two-entry (~134/143us), and small when disabled (~17us). This supports keeping first_apply diagnostic-only unless the workload target changes.","benchmark_change":"Diagnostic-only first_apply scenario metrics added; primary delta_us unchanged.","next_action_hint":"Do not precompute schedule during setup under current target; that was tried and broke startup parity. If cold first apply becomes primary, start a new metric segment."}}
{"run":116,"commit":"0375fa7","metric":-78.780056,"metrics":{"delta_p25_us":-94.729248,"delta_p75_us":-62.537001,"delta_iqr_us":32.192247,"delta_empty_us":-92.351997,"delta_two_entry_us":-90.185221,"delta_disabled_us":-89.152778,"delta_hourly_us":-45.73622,"ct_startup_us":409.885417,"minimal_startup_us":488.325277,"startup_ratio_x":0.83937,"ct_resolve_us":0.046051,"minimal_resolve_us":0.072566,"resolve_delta_us":-0.026516,"ct_apply_us":565.67552,"minimal_apply_us":560.885627,"apply_delta_us":5.72594,"apply_delta_p25_us":-0.3825,"apply_delta_p75_us":13.739063,"apply_delta_iqr_us":14.121562,"apply_delta_empty_us":10.07751,"apply_delta_two_entry_us":9.18583,"apply_delta_disabled_us":2.91125,"apply_delta_hourly_us":10.40334,"first_apply_delta_us":139.34375,"first_apply_delta_p25_us":40.114502,"first_apply_delta_p75_us":250.031494,"first_apply_delta_iqr_us":209.916992,"ct_first_apply_us":994.760498,"minimal_first_apply_us":858.364502,"first_apply_delta_empty_us":133.791016,"first_apply_delta_two_entry_us":134.166992,"first_apply_delta_disabled_us":4.458984,"first_apply_delta_hourly_us":277.666992,"command_us":56.058496,"command_p25_us":54.933203,"command_p75_us":58.879199,"command_iqr_us":3.945996},"status":"keep","description":"No-code confirmation of per-scenario cold first-apply diagnostics","timestamp":1777133546556,"segment":14,"confidence":null,"iterationTokens":2733,"asi":{"hypothesis":"Confirm per-scenario cold first-apply diagnostics and see whether hourly remains the largest first-switch gap.","result":"First-apply scenario pattern repeated: empty/two_entry around 134us, disabled near zero, hourly largest at 278us. Aggregate first_apply_delta_us is noisy (139us, IQR 210us) but consistently positive. Startup scenarios remain negative.","next_action_hint":"Keep diagnostics. Do not change primary target automatically; first_apply is a separate cold-switch workload and should only become primary with explicit target change."}}
{"type":"config","name":"Cold first-apply parity after startup parity","metricName":"first_apply_delta_us","metricUnit":"µs","bestDirection":"lower"}
