{"run":127,"commit":"e66f867","metric":106.291748,"metrics":{"delta_us":-62.608507,"delta_p25_us":-75.991943,"delta_p75_us":-50.981527,"delta_iqr_us":25.010417,"delta_empty_us":-70.736003,"delta_two_entry_us":-71.786892,"delta_disabled_us":-76.388997,"delta_hourly_us":-16.268555,"ct_startup_us":445.005832,"minimal_startup_us":503.35414,"startup_ratio_x":0.884081,"ct_resolve_us":0.052848,"minimal_resolve_us":0.089828,"resolve_delta_us":-0.03698,"ct_apply_us":569.310935,"minimal_apply_us":563.81073,"apply_delta_us":1.297917,"apply_delta_p25_us":-5.1101,"apply_delta_p75_us":13.166563,"apply_delta_iqr_us":18.276663,"apply_delta_empty_us":-0.73292,"apply_delta_two_entry_us":1.7275,"apply_delta_disabled_us":0.07417,"apply_delta_hourly_us":2.33791,"first_apply_delta_p25_us":48.447998,"first_apply_delta_p75_us":209.999756,"first_apply_delta_iqr_us":161.551758,"ct_first_apply_us":965.114502,"minimal_first_apply_us":857.364746,"first_apply_delta_empty_us":9.166992,"first_apply_delta_two_entry_us":140.791016,"first_apply_delta_disabled_us":14.041016,"first_apply_delta_hourly_us":205.958984,"command_us":59.683398,"command_p25_us":55.758301,"command_p75_us":68.3125,"command_iqr_us":12.554199},"status":"keep","description":"Seed parsed schedule from setup validation","timestamp":1777150240437,"segment":15,"confidence":3.161400913604976,"iterationTokens":25565,"asi":{"hypothesis":"Setup validation already parses schedule times. Seeding _parsed_schedule from those parsed values should reduce scheduled cold first-apply overhead without loading schedule_runtime during setup.","result":"first_apply_delta_us improved to 106.29us. Scheduled first-apply scenarios moved directionally better (two-entry 140.79us, hourly 205.96us). Startup stayed faster than minimal overall, but hourly startup margin narrowed to -16.27us.","tradeoff":"Moves allocation of parsed schedule tables/boundaries into setup for configs that already validate schedules. This is fair versus the minimal switcher but reduces startup margin on the hourly scenario.","next_action_hint":"Run no-code confirmation. Keep only if first-apply remains improved and startup scenario deltas stay negative, especially hourly."}}
{"run":128,"commit":"e66f867","metric":168.94751,"metrics":{"delta_us":-57.281196,"delta_p25_us":-68.739529,"delta_p75_us":-36.525472,"delta_iqr_us":32.214057,"delta_empty_us":-69.328559,"delta_two_entry_us":-64.180447,"delta_disabled_us":-67.236328,"delta_hourly_us":-11.430664,"ct_startup_us":454.760444,"minimal_startup_us":509.262804,"startup_ratio_x":0.892978,"ct_resolve_us":0.042153,"minimal_resolve_us":0.065016,"resolve_delta_us":-0.022863,"ct_apply_us":561.468545,"minimal_apply_us":557.220415,"apply_delta_us":1.791982,"apply_delta_p25_us":-6.186665,"apply_delta_p75_us":10.917502,"apply_delta_iqr_us":17.104167,"apply_delta_empty_us":-4.54,"apply_delta_two_entry_us":5.92916,"apply_delta_disabled_us":4.67501,"apply_delta_hourly_us":5.10708,"first_apply_delta_p25_us":39.989746,"first_apply_delta_p75_us":215.4375,"first_apply_delta_iqr_us":175.447754,"ct_first_apply_us":1054.5,"minimal_first_apply_us":902.59375,"first_apply_delta_empty_us":15.916016,"first_apply_delta_two_entry_us":216.166992,"first_apply_delta_disabled_us":61.875,"first_apply_delta_hourly_us":187.125,"command_us":56.525098,"command_p25_us":55.029297,"command_p75_us":59.649805,"command_iqr_us":4.620508},"status":"discard","description":"No-code confirmation of setup-parsed schedule cache","timestamp":1777150296634,"segment":15,"confidence":2.900794350948203,"iterationTokens":3092,"asi":{"hypothesis":"Confirm the setup-seeded parsed schedule cache before stacking further changes.","result":"Confirmation failed: first_apply_delta_us regressed to 168.95us, worse than the 149.53us segment baseline. Startup still stayed faster than minimal but the hourly startup margin remained narrow at -11.43us.","rollback_reason":"Primary failed confirmation and startup margin narrowed; first run likely noise or too dependent on sample distribution.","next_action_hint":"Revert the setup-seeded parsed schedule cache unless a second confirmation strongly recovers. Prefer returning to the confirmed empty-schedule fast path commit."}}
