{"run":117,"commit":"cd18d74","metric":149.531006,"metrics":{"delta_us":-73.446777,"delta_p25_us":-86.952474,"delta_p75_us":-63.032389,"delta_iqr_us":23.920085,"delta_empty_us":-80.060221,"delta_two_entry_us":-78.421441,"delta_disabled_us":-79.528212,"delta_hourly_us":-56.569336,"ct_startup_us":392.784614,"minimal_startup_us":470.318278,"startup_ratio_x":0.835146,"ct_resolve_us":0.051193,"minimal_resolve_us":0.090246,"resolve_delta_us":-0.039053,"ct_apply_us":546.36354,"minimal_apply_us":542.972395,"apply_delta_us":5.917708,"apply_delta_p25_us":-2.424373,"apply_delta_p75_us":12.403958,"apply_delta_iqr_us":14.82833,"apply_delta_empty_us":4.79333,"apply_delta_two_entry_us":8.51375,"apply_delta_disabled_us":-1.92624,"apply_delta_hourly_us":10.86,"first_apply_delta_p25_us":93.270508,"first_apply_delta_p75_us":208.427002,"first_apply_delta_iqr_us":115.156494,"ct_first_apply_us":997.489746,"minimal_first_apply_us":840.19751,"first_apply_delta_empty_us":150.5,"first_apply_delta_two_entry_us":151.916992,"first_apply_delta_disabled_us":2.5,"first_apply_delta_hourly_us":266.208008,"command_us":56.779297,"command_p25_us":55.674707,"command_p75_us":59.370996,"command_iqr_us":3.696289},"status":"keep","description":"Baseline cold first-apply parity segment","timestamp":1777133647137,"segment":15,"confidence":null,"iterationTokens":104,"asi":{"hypothesis":"Cold first-apply is a real colorscheme switching behavior hidden by steady-state apply averages, so start a separate first_apply_delta_us segment while preserving startup/apply/command guardrails.","benchmark_change":"Primary metric changed from startup delta_us to first_apply_delta_us; workload unchanged and startup remains a guardrail.","baseline_first_apply_delta_us":149.531006,"guardrail_delta_us":-73.446777,"guardrail_apply_delta_us":5.917708,"guardrail_command_us":56.779297,"next_action_hint":"Try only structural first-apply reductions that do not push startup delta positive, especially schedule runtime loading/preprocessing paths. Do not move work into setup unless startup guardrail remains clearly negative."}}
{"run":118,"commit":"daaf55f","metric":128.604492,"metrics":{"delta_us":-83.505697,"delta_p25_us":-89.06939,"delta_p75_us":-71.714057,"delta_iqr_us":17.355333,"delta_empty_us":-86.379557,"delta_two_entry_us":-81.064562,"delta_disabled_us":-91.22678,"delta_hourly_us":-72.254666,"ct_startup_us":383.078668,"minimal_startup_us":464.962972,"startup_ratio_x":0.823891,"ct_resolve_us":0.042761,"minimal_resolve_us":0.080829,"resolve_delta_us":-0.038068,"ct_apply_us":528.311355,"minimal_apply_us":525.782395,"apply_delta_us":0.249167,"apply_delta_p25_us":-3.128125,"apply_delta_p75_us":9.19406,"apply_delta_iqr_us":12.322185,"apply_delta_empty_us":1.0975,"apply_delta_two_entry_us":4.41,"apply_delta_disabled_us":-5.90458,"apply_delta_hourly_us":4.14458,"first_apply_delta_p25_us":121.895508,"first_apply_delta_p75_us":152.208252,"first_apply_delta_iqr_us":30.312744,"ct_first_apply_us":927.437256,"minimal_first_apply_us":796.72876,"first_apply_delta_empty_us":138.499023,"first_apply_delta_two_entry_us":148.500977,"first_apply_delta_disabled_us":9.166992,"first_apply_delta_hourly_us":216.249023,"command_us":63.387305,"command_p25_us":62.358301,"command_p75_us":64.645996,"command_iqr_us":2.287695},"status":"keep","description":"Split schedule runtime helpers for cold first apply","timestamp":1777133779413,"segment":15,"confidence":null,"iterationTokens":9158,"asi":{"hypothesis":"Core first apply pays for public schedule.lua validation/loading. Moving runtime parse/preprocess/lookup helpers into a smaller schedule_runtime.lua and re-exporting them from schedule.lua should reduce cold first-apply without moving work into setup.","result":"first_apply_delta_us improved from baseline 149.53us to 128.60us; hourly first-apply delta dropped from 266us baseline to 216us. Startup guardrail improved to delta_us=-83.51 and steady-state apply stayed near parity. command_us worsened to 63.39us and needs confirmation.","tradeoff":"Adds an internal schedule_runtime module and duplicates some validation logic between runtime preprocessing and public validate_entry. This is acceptable only if first-apply improvement confirms.","next_action_hint":"Run no-code confirmation. If command regression persists or first-apply improvement does not repeat, discard this split."}}
{"run":119,"commit":"daaf55f","metric":151.708252,"metrics":{"delta_us":-87.92947,"delta_p25_us":-92.893419,"delta_p75_us":-80.630859,"delta_iqr_us":12.26256,"delta_empty_us":-98.856228,"delta_two_entry_us":-92.430773,"delta_disabled_us":-92.504557,"delta_hourly_us":-76.023329,"ct_startup_us":372.156386,"minimal_startup_us":458.170193,"startup_ratio_x":0.812267,"ct_resolve_us":0.05964,"minimal_resolve_us":0.107247,"resolve_delta_us":-0.047607,"ct_apply_us":525.740413,"minimal_apply_us":522.876982,"apply_delta_us":2.39875,"apply_delta_p25_us":-1.45594,"apply_delta_p75_us":10.771045,"apply_delta_iqr_us":12.226985,"apply_delta_empty_us":-0.65917,"apply_delta_two_entry_us":4.81542,"apply_delta_disabled_us":2.99333,"apply_delta_hourly_us":2.18084,"first_apply_delta_p25_us":142.166748,"first_apply_delta_p75_us":164.280762,"first_apply_delta_iqr_us":22.114014,"ct_first_apply_us":970.781494,"minimal_first_apply_us":822.541748,"first_apply_delta_empty_us":156.833008,"first_apply_delta_two_entry_us":166.791016,"first_apply_delta_disabled_us":15.541992,"first_apply_delta_hourly_us":238.125,"command_us":60.716895,"command_p25_us":58.320801,"command_p75_us":62.954395,"command_iqr_us":4.633594},"status":"discard","description":"No-code confirmation of schedule runtime split","timestamp":1777133839136,"segment":15,"confidence":9.61146053316898,"iterationTokens":2782,"asi":{"hypothesis":"Confirm whether the schedule_runtime split truly improves cold first-apply or was noise.","rollback_reason":"No production change was made and first_apply_delta_us reran worse than the new baseline (151.71us vs 149.53us), so the initial 128.60us improvement did not confirm. Added module/validation duplication is not justified.","next_action_hint":"Discard/revert schedule_runtime split; do not retry this split shape unless redesign removes duplication and has a larger repeated first_apply win."}}
{"run":120,"commit":"daaf55f","metric":181.333008,"metrics":{"delta_us":-83.651557,"delta_p25_us":-95.494141,"delta_p75_us":-72.974501,"delta_iqr_us":22.51964,"delta_empty_us":-90.370226,"delta_two_entry_us":-88.995226,"delta_disabled_us":-93.346897,"delta_hourly_us":-66.050564,"ct_startup_us":389.583306,"minimal_startup_us":475.096029,"startup_ratio_x":0.82001,"ct_resolve_us":0.04641,"minimal_resolve_us":0.071547,"resolve_delta_us":-0.025137,"ct_apply_us":528.13823,"minimal_apply_us":527.408333,"apply_delta_us":1.857813,"apply_delta_p25_us":-4.7226,"apply_delta_p75_us":6.819998,"apply_delta_iqr_us":11.542598,"apply_delta_empty_us":0.12166,"apply_delta_two_entry_us":-0.67584,"apply_delta_disabled_us":-5.41083,"apply_delta_hourly_us":5.84708,"first_apply_delta_p25_us":166.239502,"first_apply_delta_p75_us":201.146484,"first_apply_delta_iqr_us":34.906982,"ct_first_apply_us":1018.552002,"minimal_first_apply_us":836.083008,"first_apply_delta_empty_us":174.375,"first_apply_delta_two_entry_us":198.083008,"first_apply_delta_disabled_us":18.458984,"first_apply_delta_hourly_us":309.416992,"command_us":60.758105,"command_p25_us":58.162305,"command_p75_us":66.312402,"command_iqr_us":8.150098},"status":"discard","description":"Revert schedule runtime split after failed confirmation","timestamp":1777133960571,"segment":15,"confidence":1.811524531071999,"iterationTokens":5448,"asi":{"hypothesis":"Because schedule_runtime split failed no-code confirmation, revert it for maintainability unless the first_apply metric worsens materially.","rollback_reason":"Reverting produced first_apply_delta_us=181.33us, worse than both baseline and the split run. Under current first_apply primary rules this revert cannot be kept, even though the split's confirmation was noisy.","next_action_hint":"Keep schedule_runtime split for now because revert probe worsened primary. Do not stack more changes until another no-code confirmation clarifies whether the split's benefit is real."}}
{"run":121,"commit":"2227e9c","metric":128.197754,"metrics":{"delta_us":-89.881972,"delta_p25_us":-98.483968,"delta_p75_us":-77.57411,"delta_iqr_us":20.909858,"delta_empty_us":-99.087891,"delta_two_entry_us":-89.166775,"delta_disabled_us":-90.069336,"delta_hourly_us":-80.847114,"ct_startup_us":366.869222,"minimal_startup_us":457.990831,"startup_ratio_x":0.801041,"ct_resolve_us":0.055349,"minimal_resolve_us":0.111275,"resolve_delta_us":-0.055926,"ct_apply_us":528.508748,"minimal_apply_us":522.25104,"apply_delta_us":5.066458,"apply_delta_p25_us":-0.963645,"apply_delta_p75_us":12.553123,"apply_delta_iqr_us":13.516768,"apply_delta_empty_us":2.08333,"apply_delta_two_entry_us":6.25583,"apply_delta_disabled_us":3.32834,"apply_delta_hourly_us":8.83499,"first_apply_delta_p25_us":121.416748,"first_apply_delta_p75_us":137.71875,"first_apply_delta_iqr_us":16.302002,"ct_first_apply_us":919.791504,"minimal_first_apply_us":792.197754,"first_apply_delta_empty_us":136.958008,"first_apply_delta_two_entry_us":143.333008,"first_apply_delta_disabled_us":10.666016,"first_apply_delta_hourly_us":222.583008,"command_us":56.024902,"command_p25_us":55.175098,"command_p75_us":58.245996,"command_iqr_us":3.070898},"status":"keep","description":"No-code reconfirmation of schedule runtime split","timestamp":1777134044831,"segment":15,"confidence":1.0194364909511442,"iterationTokens":2840,"asi":{"hypothesis":"Reconfirm schedule_runtime split after one failed no-code confirmation and a revert probe that worsened first_apply_delta_us.","result":"first_apply_delta_us returned to 128.20us, matching the initial split run (128.60us) and beating baseline 149.53us. Startup guardrail improved strongly (delta_us=-89.88), command_us normalized to 56.02us, and first_apply_iqr shrank to 16.30us.","tradeoff":"The split still adds an internal runtime module and partial validation duplication, but repeated first-apply improvement plus clean guardrails now justify keeping it under the first-apply segment.","next_action_hint":"Keep schedule_runtime split. Avoid further broad schedule rewrites unless they reduce duplication without hurting first_apply."}}
{"run":122,"commit":"67f9bd9","metric":125.260254,"metrics":{"delta_us":-84.8565,"delta_p25_us":-93.865804,"delta_p75_us":-73.591336,"delta_iqr_us":20.274468,"delta_empty_us":-89.050781,"delta_two_entry_us":-91.25944,"delta_disabled_us":-89.124674,"delta_hourly_us":-63.018446,"ct_startup_us":374.06486,"minimal_startup_us":455.944526,"startup_ratio_x":0.820417,"ct_resolve_us":0.052704,"minimal_resolve_us":0.089431,"resolve_delta_us":-0.036727,"ct_apply_us":523.39531,"minimal_apply_us":526.48198,"apply_delta_us":-2.45406,"apply_delta_p25_us":-5.231458,"apply_delta_p75_us":5.26302,"apply_delta_iqr_us":10.494478,"apply_delta_empty_us":3.61916,"apply_delta_two_entry_us":1.17209,"apply_delta_disabled_us":-1.58916,"apply_delta_hourly_us":-0.05041,"first_apply_delta_p25_us":110.572754,"first_apply_delta_p75_us":162.114746,"first_apply_delta_iqr_us":51.541992,"ct_first_apply_us":921.47876,"minimal_first_apply_us":793.61499,"first_apply_delta_empty_us":145.625,"first_apply_delta_two_entry_us":160.041992,"first_apply_delta_disabled_us":9.458008,"first_apply_delta_hourly_us":200.624023,"command_us":56.0625,"command_p25_us":55.141699,"command_p75_us":60.558398,"command_iqr_us":5.416699},"status":"keep","description":"Re-export schedule validation from runtime module","timestamp":1777134150562,"segment":15,"confidence":2.0646735768846756,"iterationTokens":5970,"asi":{"hypothesis":"Expose validate_entry from schedule_runtime and re-export it from schedule.lua to remove validation duplication introduced by the first-apply runtime split.","result":"first_apply_delta_us improved to 125.26us, slightly better than the confirmed runtime split. Steady-state apply improved to -2.45us and command/startup guardrails stayed acceptable.","tradeoff":"Public schedule.lua is now a thin wrapper around schedule_runtime; schedule_runtime becomes the source of truth for validation and runtime parsing.","next_action_hint":"Run no-code confirmation. If confirmed, keep as cleaner schedule split; otherwise revert only this validation re-export, not the whole runtime split."}}
{"run":123,"commit":"2c59b5f","metric":144.062744,"metrics":{"delta_us":-80.460639,"delta_p25_us":-97.151611,"delta_p75_us":-62.328695,"delta_iqr_us":34.822917,"delta_empty_us":-94.356228,"delta_two_entry_us":-94.73622,"delta_disabled_us":-92.8699,"delta_hourly_us":-61.185547,"ct_startup_us":404.907444,"minimal_startup_us":490.836806,"startup_ratio_x":0.824933,"ct_resolve_us":0.05237,"minimal_resolve_us":0.087564,"resolve_delta_us":-0.035194,"ct_apply_us":562.01208,"minimal_apply_us":560.467083,"apply_delta_us":3.65875,"apply_delta_p25_us":-3.21073,"apply_delta_p75_us":9.76823,"apply_delta_iqr_us":12.97896,"apply_delta_empty_us":-0.25667,"apply_delta_two_entry_us":-0.73875,"apply_delta_disabled_us":0.68834,"apply_delta_hourly_us":5.44999,"first_apply_delta_p25_us":113.656494,"first_apply_delta_p75_us":229.030762,"first_apply_delta_iqr_us":115.374268,"ct_first_apply_us":1041.4375,"minimal_first_apply_us":882.40625,"first_apply_delta_empty_us":205.625,"first_apply_delta_two_entry_us":154.75,"first_apply_delta_disabled_us":22.75,"first_apply_delta_hourly_us":259.625,"command_us":60.650098,"command_p25_us":57.766797,"command_p75_us":67.095703,"command_iqr_us":9.328906},"status":"keep","description":"No-code confirmation of schedule validation re-export","timestamp":1777134259469,"segment":15,"confidence":1.570083862004576,"iterationTokens":2690,"asi":{"hypothesis":"Confirm the validation re-export cleanup after its first run improved first_apply_delta_us and reduced schedule split duplication.","result":"Confirmation was noisy but still beat the first-apply baseline (144.06us vs 149.53us). Startup guardrail stayed clearly negative. The cleaner split removes duplicated validation logic, so it remains worth keeping despite weaker metric confirmation.","tradeoff":"Public schedule.lua is a thin re-export wrapper; validation behavior is sourced from schedule_runtime and still covered by schedule tests.","next_action_hint":"Keep this cleanup. Avoid more first-apply schedule changes unless they show large repeated wins beyond the first_apply IQR."}}
{"run":124,"commit":"f006ab4","metric":111.062012,"metrics":{"delta_us":-82.738444,"delta_p25_us":-110.450304,"delta_p75_us":-32.425808,"delta_iqr_us":78.024495,"delta_empty_us":-88.212999,"delta_two_entry_us":-64.879774,"delta_disabled_us":-84.037109,"delta_hourly_us":-41.634332,"ct_startup_us":439.775472,"minimal_startup_us":519.414361,"startup_ratio_x":0.846676,"ct_resolve_us":0.047994,"minimal_resolve_us":0.094175,"resolve_delta_us":-0.046181,"ct_apply_us":541.143752,"minimal_apply_us":541.42146,"apply_delta_us":4.477917,"apply_delta_p25_us":-1.345312,"apply_delta_p75_us":11.264998,"apply_delta_iqr_us":12.61031,"apply_delta_empty_us":1.79083,"apply_delta_two_entry_us":2.4,"apply_delta_disabled_us":1.09959,"apply_delta_hourly_us":5.87459,"first_apply_delta_p25_us":67.395996,"first_apply_delta_p75_us":146.697754,"first_apply_delta_iqr_us":79.301758,"ct_first_apply_us":940.666504,"minimal_first_apply_us":841.864502,"first_apply_delta_empty_us":10.791992,"first_apply_delta_two_entry_us":193.708984,"first_apply_delta_disabled_us":2.833008,"first_apply_delta_hourly_us":225.624023,"command_us":56.845898,"command_p25_us":54.895898,"command_p75_us":62.025195,"command_iqr_us":7.129297},"status":"keep","description":"Skip schedule runtime when schedule is empty","timestamp":1777134381859,"segment":15,"confidence":3.1699878108432746,"iterationTokens":7442,"asi":{"hypothesis":"Empty schedules do not need schedule preprocessing, active-entry lookup, or boundary timers. Skipping schedule runtime for empty schedules should reduce cold first-apply overhead without changing behavior.","result":"first_apply_delta_us improved from 149.53us baseline and 144.06us confirmation to 111.06us. Empty first-apply delta collapsed from ~150us to 10.79us. Startup remains faster than minimal, steady-state apply remains near parity, command guardrail acceptable.","tradeoff":"Adds simple empty-schedule branches in resolve_theme_parts, needs_system_poll, and arm_schedule_timer. This is behavior-preserving for empty schedules and avoids needless timer scheduling.","next_action_hint":"Run no-code confirmation before stacking. If confirmed, keep; if noisy, consider that empty first-apply scenario showed the expected directional improvement."}}
{"run":125,"commit":"81218e2","metric":133.39624,"metrics":{"delta_us":-80.033664,"delta_p25_us":-90.401611,"delta_p75_us":-65.652724,"delta_iqr_us":24.748888,"delta_empty_us":-86.684896,"delta_two_entry_us":-77.152669,"delta_disabled_us":-78.055339,"delta_hourly_us":-66.824002,"ct_startup_us":418.900445,"minimal_startup_us":492.782471,"startup_ratio_x":0.850072,"ct_resolve_us":0.049164,"minimal_resolve_us":0.096958,"resolve_delta_us":-0.047794,"ct_apply_us":567.466667,"minimal_apply_us":557.783853,"apply_delta_us":6.6125,"apply_delta_p25_us":2.102607,"apply_delta_p75_us":11.55552,"apply_delta_iqr_us":9.452913,"apply_delta_empty_us":-0.27375,"apply_delta_two_entry_us":2.20416,"apply_delta_disabled_us":5.47291,"apply_delta_hourly_us":15.63792,"first_apply_delta_p25_us":82.822998,"first_apply_delta_p75_us":190.885498,"first_apply_delta_iqr_us":108.0625,"ct_first_apply_us":1000.531006,"minimal_first_apply_us":883.427002,"first_apply_delta_empty_us":0.208008,"first_apply_delta_two_entry_us":214.541992,"first_apply_delta_disabled_us":7.541016,"first_apply_delta_hourly_us":252.25,"command_us":58.995703,"command_p25_us":56.383301,"command_p75_us":62.85,"command_iqr_us":6.466699},"status":"keep","description":"No-code confirmation of empty-schedule first-apply fast path","timestamp":1777149928977,"segment":15,"confidence":3.6065231869786,"iterationTokens":2767,"asi":{"hypothesis":"Confirm the empty-schedule fast path before stacking further first-apply changes.","result":"first_apply_delta_us confirmed below baseline at 133.40us, though noisier than first run 111.06us. Empty first-apply delta stayed near zero at 0.21us, confirming the intended empty-schedule effect. Startup guardrail stayed negative; steady-state apply guardrail is within measured noise/IQR.","next_action_hint":"Keep empty-schedule fast path. Next only target scheduled first-apply scenarios if change is structural and startup guardrail remains negative."}}
{"run":126,"commit":"81218e2","metric":130.385498,"metrics":{"delta_us":-73.974365,"delta_p25_us":-93.933919,"delta_p75_us":-43.298665,"delta_iqr_us":50.635254,"delta_empty_us":-82.235894,"delta_two_entry_us":-81.907661,"delta_disabled_us":-76.902778,"delta_hourly_us":-51.680556,"ct_startup_us":424.86461,"minimal_startup_us":489.043945,"startup_ratio_x":0.868766,"ct_resolve_us":0.061335,"minimal_resolve_us":0.101258,"resolve_delta_us":-0.039922,"ct_apply_us":562.618438,"minimal_apply_us":559.648333,"apply_delta_us":0.020002,"apply_delta_p25_us":-8.266458,"apply_delta_p75_us":7.931667,"apply_delta_iqr_us":16.198125,"apply_delta_empty_us":-4.22667,"apply_delta_two_entry_us":-0.13958,"apply_delta_disabled_us":-1.71583,"apply_delta_hourly_us":2.00167,"first_apply_delta_p25_us":96.000488,"first_apply_delta_p75_us":178.895752,"first_apply_delta_iqr_us":82.895264,"ct_first_apply_us":966.802002,"minimal_first_apply_us":832.53125,"first_apply_delta_empty_us":9.375,"first_apply_delta_two_entry_us":183.166992,"first_apply_delta_disabled_us":3.416016,"first_apply_delta_hourly_us":239.166992,"command_us":57.416602,"command_p25_us":55.424902,"command_p75_us":61.508203,"command_iqr_us":6.083301},"status":"discard","description":"Try trusted core-only schedule preprocessing","timestamp":1777150105919,"segment":15,"confidence":4.091904210559345,"iterationTokens":2767,"asi":{"hypothesis":"A core-only trusted preprocessing path for schedules already validated by setup/persisted-state validation might reduce scheduled first-apply overhead while keeping public schedule.preprocess validation intact.","result":"Aggregate first_apply_delta_us was only 3us better than the previous no-code confirmation and far inside the 82.9us IQR. Scheduled scenarios moved directionally better, but not enough to justify duplicate preprocessing paths.","rollback_reason":"Marginal sub-10us aggregate movement below noise plus added internal preprocessing duplication/maintenance risk.","next_action_hint":"Keep public validated preprocess path for core. Do not retry trusted preprocess unchanged unless benchmark precision improves or a larger scheduled-scenario target is adopted."}}
