{"run":64,"commit":"86491a2","metric":-90.576904,"metrics":{"ct_startup_us":390.881201,"minimal_startup_us":481.072803,"startup_ratio_x":0.81252,"ct_resolve_us":0.046227,"minimal_resolve_us":0.074902,"resolve_delta_us":-0.028676,"ct_apply_us":564.026458,"minimal_apply_us":568.76021,"apply_delta_us":-5.641145,"command_us":84.087402},"status":"discard","description":"Use noref deepcopy only for base config while keeping user opts deepcopy regular","timestamp":1777129007648,"segment":9,"confidence":null,"iterationTokens":1530,"asi":{"hypothesis":"Opposite split of the noref deepcopy experiment may show whether base config copy, not user opts copy, is the actual beneficiary under stable startup measurement.","rollback_reason":"Primary delta_us was slightly better than baseline but not better than current opts-only noref best, and command_us guardrail regressed badly to 84.09us. Not worth keeping.","next_action_hint":"Do not pursue more noref split experiments; measurements are noisy and guardrails vary."}}
{"run":65,"commit":"86491a2","metric":-88.347803,"metrics":{"ct_startup_us":415.993799,"minimal_startup_us":506.220703,"startup_ratio_x":0.821764,"ct_resolve_us":0.050404,"minimal_resolve_us":0.072241,"resolve_delta_us":-0.021836,"ct_apply_us":576.740725,"minimal_apply_us":573.766042,"apply_delta_us":1.3775,"command_us":62.133301},"status":"discard","description":"Move status table construction into a lazily required status module","timestamp":1777129379087,"segment":9,"confidence":null,"iterationTokens":13402,"asi":{"hypothesis":"Status reporting is not needed for setup; moving its larger table-building body out of core.lua should reduce core parse/load time without changing public status behavior.","rollback_reason":"Primary delta_us did not improve enough versus current best and added private helper surface plus a new module; extra indirection/risk is not worth the small noisy signal.","next_action_hint":"Do not split status alone. A broader public API split would need larger confirmed gains and careful tests."}}
{"run":66,"commit":"86491a2","metric":-83.650049,"metrics":{"ct_startup_us":434.320654,"minimal_startup_us":504.15415,"startup_ratio_x":0.861484,"ct_resolve_us":0.052144,"minimal_resolve_us":0.069801,"resolve_delta_us":-0.017657,"ct_apply_us":569.138647,"minimal_apply_us":567.402708,"apply_delta_us":2.31448,"command_us":58.450098},"status":"discard","description":"Replace core-local setup time validation pattern matching with byte parsing","timestamp":1777129458096,"segment":9,"confidence":null,"iterationTokens":2987,"asi":{"hypothesis":"Manual byte parsing can validate HH:MM times without string.match or tonumber during setup, improving the 24-entry schedule scenario while preserving accepted formats.","rollback_reason":"Primary delta_us did not improve versus current best enough to justify much more complex validation code; maintainability is worse.","next_action_hint":"Keep string.match/tonumber validate_time. Do not retry manual byte parsing."}}
{"run":67,"commit":"86491a2","metric":-108.054004,"metrics":{"ct_startup_us":430.4729,"minimal_startup_us":533.939551,"startup_ratio_x":0.80622,"ct_resolve_us":0.076071,"minimal_resolve_us":0.073373,"resolve_delta_us":0.002698,"ct_apply_us":549.665833,"minimal_apply_us":544.951563,"apply_delta_us":3.591978,"command_us":58.345801},"status":"checks_failed","description":"Probe upper-bound startup savings from skipping focus autocmd registration entirely","timestamp":1777129547297,"segment":9,"confidence":null,"iterationTokens":3339,"asi":{"hypothesis":"Focus autocmd registration may be a sizable setup cost; removing it entirely estimates the maximum possible win before attempting a correct conditional design.","rollback_reason":"Correctness checks failed because focus autocmd behavior is covered by tests and required for system-background polling. This probe is not keepable as-is.","benchmark_signal":"delta_us improved to -108.05us, suggesting autocmd registration is a real cost, but removing it would be incorrect and risks overfitting to non-system benchmark configs.","next_action_hint":"Only pursue conditional focus autocmd registration if adding tests for system backgrounds, persisted state, reload, and enable/disable. Otherwise leave unconditional autocmds."}}
{"run":68,"commit":"86491a2","metric":-60.837695,"metrics":{"ct_startup_us":425.129248,"minimal_startup_us":480.400049,"startup_ratio_x":0.884948,"ct_resolve_us":0.044369,"minimal_resolve_us":0.073478,"resolve_delta_us":-0.029109,"ct_apply_us":551.940833,"minimal_apply_us":547.579998,"apply_delta_us":3.246978,"command_us":57.916699},"status":"discard","description":"Conditionally register focus autocmds only when system backgrounds are possible","timestamp":1777129664736,"segment":9,"confidence":null,"iterationTokens":9086,"asi":{"hypothesis":"Focus autocmds are only needed when a config can request background='system'; non-system configs can skip registration while tests cover the system-background path.","rollback_reason":"Primary delta_us regressed badly from current best to -60.84us. Schedule scanning and sync logic outweighed avoiding autocmd API calls, even though correctness checks passed with updated tests.","next_action_hint":"Do not pursue conditional focus autocmd registration in this code shape. Keep unconditional focus autocmds despite probe showing an upper-bound speedup."}}
{"type":"config","name":"Apply speed with schedule runtime split exploration","metricName":"apply_delta_us","metricUnit":"µs","bestDirection":"lower"}
{"run":69,"commit":"a5be349","metric":2.975103,"metrics":{"delta_us":-68.168701,"ct_startup_us":456.133398,"minimal_startup_us":524.581348,"startup_ratio_x":0.869519,"ct_resolve_us":0.047433,"minimal_resolve_us":0.081182,"resolve_delta_us":-0.033749,"ct_apply_us":590.974998,"minimal_apply_us":590.630835,"command_us":76.183398},"status":"keep","description":"Baseline apply speed before schedule runtime split exploration","timestamp":1777129755552,"segment":10,"confidence":null,"iterationTokens":102,"asi":{"hypothesis":"Switch back to apply_delta_us to explore schedule runtime split while startup and command remain guardrails.","benchmark_change":"Metric changed to apply_delta_us; same broadened four-scenario benchmark, paired apply delta, stable startup iterations retained.","baseline_apply_delta_us":2.975103,"guardrail_delta_us":-68.168701,"guardrail_command_us":76.183398,"next_action_hint":"Try splitting schedule runtime code from public validation wrapper only if public require('colorful-times.schedule') API can remain unchanged."}}
{"type":"config","name":"Apply speed with alternating paired measurement order","metricName":"apply_delta_us","metricUnit":"µs","bestDirection":"lower"}
{"run":70,"commit":"3f511ef","metric":0.352397,"metrics":{"delta_us":-84.464648,"ct_startup_us":425.433496,"minimal_startup_us":522.279199,"startup_ratio_x":0.814571,"ct_resolve_us":0.048729,"minimal_resolve_us":0.078832,"resolve_delta_us":-0.030103,"ct_apply_us":570.202085,"minimal_apply_us":568.231458,"command_us":55.375195},"status":"keep","description":"Baseline after alternating paired startup/apply measurement order","timestamp":1777129829737,"segment":11,"confidence":null,"iterationTokens":102,"asi":{"hypothesis":"Alternating Colorful Times/minimal order inside paired startup and apply samples should reduce ordering bias without favoring either implementation.","benchmark_change":"Metric implementation changed; apply_delta_us and delta_us now alternate CT/minimal order per paired sample.","baseline_apply_delta_us":0.352397,"guardrail_delta_us":-84.464648,"guardrail_command_us":55.375195,"next_action_hint":"With apply nearly at parity under alternating pairs, only keep schedule runtime split if it gives a clearly repeated improvement without hurting startup."}}
{"run":71,"commit":"3f511ef","metric":3.50844,"metrics":{"delta_us":-70.470654,"ct_startup_us":446.98125,"minimal_startup_us":509.966699,"startup_ratio_x":0.876491,"ct_resolve_us":0.045314,"minimal_resolve_us":0.059606,"resolve_delta_us":-0.014292,"ct_apply_us":563.503018,"minimal_apply_us":560.469268,"command_us":59.062695},"status":"discard","description":"No-code confirmation of alternating paired apply baseline","timestamp":1777129863799,"segment":11,"confidence":null,"iterationTokens":1202,"asi":{"hypothesis":"Confirm the alternating-order paired apply baseline before investing in schedule runtime split.","rollback_reason":"No production change was made and apply_delta_us reran worse than baseline (3.51us vs 0.35us), confirming remaining apply differences are small and noisy.","next_action_hint":"Avoid large schedule-runtime refactors unless they provide clear code simplicity or repeated >5us apply improvement."}}
{"run":72,"commit":"3f511ef","metric":3.01021,"metrics":{"delta_us":-97.893652,"ct_startup_us":411.512549,"minimal_startup_us":505.318799,"startup_ratio_x":0.814362,"ct_resolve_us":0.04943,"minimal_resolve_us":0.079302,"resolve_delta_us":-0.029872,"ct_apply_us":565.556455,"minimal_apply_us":563.812603,"command_us":59.208594},"status":"checks_failed","description":"Move open() wrapper from core.lua to init.lua to reduce core parse size","timestamp":1777129925255,"segment":11,"confidence":null,"iterationTokens":2794,"asi":{"hypothesis":"TUI open wrapper is not needed by setup/apply; moving it out of core.lua could shrink core parse/load slightly while preserving command behavior.","rollback_reason":"Correctness checks failed, likely because lazy-loading expectations/tests depend on open being a core-provided lazy key. The measured apply_delta_us also worsened versus baseline.","next_action_hint":"Keep open defined in core.lua. Any broader public API split needs explicit test updates and larger expected gains."}}
{"run":73,"commit":"3f511ef","metric":0.152603,"metrics":{"delta_us":-91.743896,"ct_startup_us":404.485303,"minimal_startup_us":495.1521,"startup_ratio_x":0.816891,"ct_resolve_us":0.052595,"minimal_resolve_us":0.058574,"resolve_delta_us":-0.005979,"ct_apply_us":559.0224,"minimal_apply_us":559.74677,"command_us":61.658398},"status":"discard","description":"Probe core-only schedule runtime split avoiding public schedule module load","timestamp":1777130140220,"segment":11,"confidence":null,"iterationTokens":2794,"asi":{"hypothesis":"Core hot paths may only need a smaller runtime schedule helper, avoiding load/parse of public schedule validation functions during first apply while public color-times.schedule remains unchanged.","rollback_reason":"Primary improvement was only 0.20us versus baseline, far below observed no-code noise, while adding duplicated schedule logic and worsening command_us from 55.38us to 61.66us. Not a maintainable keepable win.","next_action_hint":"Prune schedule-runtime split unless redesigned to remove duplication and deliver repeated >5us apply improvement."}}
{"run":74,"commit":"3f511ef","metric":2.395522,"metrics":{"delta_us":-90.954395,"ct_startup_us":405.335498,"minimal_startup_us":500.866699,"startup_ratio_x":0.809268,"ct_resolve_us":0.050091,"minimal_resolve_us":0.071869,"resolve_delta_us":-0.021778,"ct_apply_us":573.921875,"minimal_apply_us":566.038333,"command_us":61.895703},"status":"discard","description":"Localize default config table in resolve_theme_parts hot path","timestamp":1777130188770,"segment":11,"confidence":null,"iterationTokens":3307,"asi":{"hypothesis":"Binding cfg.default to a local should reduce repeated table lookups in apply/resolve without changing behavior.","rollback_reason":"Primary apply_delta_us regressed from 0.35us to 2.40us; extra local did not help under the benchmark.","next_action_hint":"Keep current direct cfg.default lookups. Avoid table-lookup micro-optimizations in resolve_theme_parts unless paired with structural simplification."}}
{"type":"config","name":"Startup structural split after apply parity","metricName":"delta_us","metricUnit":"µs","bestDirection":"lower"}
{"run":75,"commit":"5aa2767","metric":-107.7854,"metrics":{"ct_startup_us":398.331152,"minimal_startup_us":509.595752,"startup_ratio_x":0.781661,"ct_resolve_us":0.089347,"minimal_resolve_us":0.100071,"resolve_delta_us":-0.010724,"ct_apply_us":565.757605,"minimal_apply_us":561.096667,"apply_delta_us":6.78448,"command_us":64.954395},"status":"keep","description":"Baseline startup structural split segment after apply parity","timestamp":1777130243426,"segment":12,"confidence":null,"iterationTokens":100,"asi":{"hypothesis":"Apply parity is noise-limited; switch primary back to stable paired startup delta for remaining structural split ideas while preserving apply and command guardrails.","benchmark_change":"Metric changed from apply_delta_us to delta_us; workload remains the four-scenario alternating paired benchmark with five startup cycles per sample.","baseline_delta_us":-107.7854,"guardrail_apply_delta_us":6.78448,"guardrail_command_us":64.954395,"next_action_hint":"Only test coherent startup structural splits; avoid one-method open/status moves already tried."}}
{"run":76,"commit":"5aa2767","metric":-77.902002,"metrics":{"ct_startup_us":414.766748,"minimal_startup_us":497.624951,"startup_ratio_x":0.833493,"ct_resolve_us":0.046566,"minimal_resolve_us":0.060661,"resolve_delta_us":-0.014095,"ct_apply_us":563.10729,"minimal_apply_us":565.32427,"apply_delta_us":2.543955,"command_us":57.095801},"status":"discard","description":"Group default option validation around local table","timestamp":1777130287874,"segment":12,"confidence":null,"iterationTokens":3671,"asi":{"hypothesis":"Grouping opts.default validation under one local should avoid repeated nested table lookups during setup without changing validation behavior.","rollback_reason":"Primary delta_us regressed from -107.79us to -77.90us; this rewrite was slower despite being readable.","next_action_hint":"Keep current repeated opts.default checks. Avoid validation-locality rewrites unless they remove work, not just lookups."}}
{"run":77,"commit":"5aa2767","metric":-93.674902,"metrics":{"ct_startup_us":430.268604,"minimal_startup_us":514.598047,"startup_ratio_x":0.836126,"ct_resolve_us":0.048788,"minimal_resolve_us":0.067838,"resolve_delta_us":-0.01905,"ct_apply_us":561.58844,"minimal_apply_us":559.03604,"apply_delta_us":1.034167,"command_us":59.771094},"status":"discard","description":"Lazy access vim.uv only in timer start paths","timestamp":1777130345148,"segment":12,"confidence":null,"iterationTokens":3118,"asi":{"hypothesis":"Removing the top-level uv local may shrink core setup load; timers can access vim.uv only when started later.","rollback_reason":"Primary delta_us regressed from -107.79us to -93.67us. The top-level uv local is not a startup bottleneck and local access is clearer for timer paths.","next_action_hint":"Keep local uv = vim.uv. Avoid single top-level lookup removals."}}
{"run":78,"commit":"09e67bd","metric":-111.995996,"metrics":{"ct_startup_us":426.495898,"minimal_startup_us":527.3729,"startup_ratio_x":0.808718,"ct_resolve_us":0.050085,"minimal_resolve_us":0.103922,"resolve_delta_us":-0.053836,"ct_apply_us":563.5375,"minimal_apply_us":562.702502,"apply_delta_us":-1.27198,"command_us":60.741699},"status":"keep","description":"Use numeric loop for setup schedule validation","timestamp":1777130550143,"segment":12,"confidence":null,"iterationTokens":4041,"asi":{"hypothesis":"Setup validation walks a Lua array; a numeric loop can reduce iterator overhead for scheduled configs, especially the 24-entry scenario, without changing validation behavior or public API.","result":"delta_us improved from -107.79us to -112.00us. Apply guardrail also improved to -1.27us and command_us improved versus segment baseline.","tradeoff":"Change is a small style shift from ipairs to numeric indexing in setup validation only. Need no-code confirmation because improvement is near the noise threshold.","next_action_hint":"Run a no-code confirmation before stacking more setup validation loop changes."}}
{"run":79,"commit":"09e67bd","metric":-86.806396,"metrics":{"ct_startup_us":414.972852,"minimal_startup_us":505.9729,"startup_ratio_x":0.820148,"ct_resolve_us":0.049969,"minimal_resolve_us":0.085855,"resolve_delta_us":-0.035886,"ct_apply_us":554.966147,"minimal_apply_us":552.22104,"apply_delta_us":2.674583,"command_us":61.720996},"status":"discard","description":"No-code confirmation of numeric setup schedule validation loop","timestamp":1777130577153,"segment":12,"confidence":null,"iterationTokens":1313,"asi":{"hypothesis":"Confirm the numeric setup schedule validation loop before stacking more validation-loop changes because first improvement was near noise threshold.","rollback_reason":"No production change was made and delta_us reran worse (-86.81us), so the -112.00us result is not confirmed. The numeric loop remains kept only because it is simple and was already committed; treat its speed signal as weak.","next_action_hint":"Do not stack more numeric-loop rewrites based only on the first run. Consider reverting later for style if more confirmations stay worse."}}
{"run":80,"commit":"09e67bd","metric":-81.431348,"metrics":{"ct_startup_us":438.552148,"minimal_startup_us":515.293701,"startup_ratio_x":0.851072,"ct_resolve_us":0.03761,"minimal_resolve_us":0.044086,"resolve_delta_us":-0.006476,"ct_apply_us":572.584375,"minimal_apply_us":566.858018,"apply_delta_us":3.632292,"command_us":58.270898},"status":"discard","description":"Revert numeric validation loop back to ipairs","timestamp":1777130607036,"segment":12,"confidence":null,"iterationTokens":1684,"asi":{"hypothesis":"Because numeric-loop confirmation was weak, reverting to idiomatic ipairs may be neutral or better under another sample.","rollback_reason":"Primary delta_us worsened to -81.43us, so the revert was not kept. Current code keeps the numeric validation loop despite weak confirmation.","next_action_hint":"Leave the numeric loop for now but do not infer that other ipairs-to-numeric rewrites are beneficial."}}
{"run":81,"commit":"09e67bd","metric":-83.341748,"metrics":{"ct_startup_us":394.318701,"minimal_startup_us":485.077246,"startup_ratio_x":0.812899,"ct_resolve_us":0.042033,"minimal_resolve_us":0.053813,"resolve_delta_us":-0.01178,"ct_apply_us":552.879792,"minimal_apply_us":548.275107,"apply_delta_us":-0.053962,"command_us":58.724805},"status":"discard","description":"Bind opts.schedule local before validation loop","timestamp":1777130642478,"segment":12,"confidence":null,"iterationTokens":2022,"asi":{"hypothesis":"A local opts_schedule could avoid repeated nested table lookups in setup schedule validation after the numeric-loop change.","rollback_reason":"Primary delta_us regressed to -83.34us. Extra local/rewrite did not help and the numeric loop's weak signal should not be extended.","next_action_hint":"Keep the committed numeric loop exactly as-is; avoid further schedule validation loop micro-edits."}}
{"type":"config","name":"Stable startup delta with 31 paired samples","metricName":"delta_us","metricUnit":"µs","bestDirection":"lower"}
{"run":82,"commit":"94ce604","metric":-92.008154,"metrics":{"ct_startup_us":406.118701,"minimal_startup_us":495.881396,"startup_ratio_x":0.818984,"ct_resolve_us":0.047658,"minimal_resolve_us":0.098665,"resolve_delta_us":-0.051007,"ct_apply_us":548.443025,"minimal_apply_us":549.86875,"apply_delta_us":1.292185,"command_us":56.3375},"status":"keep","description":"Baseline startup delta with 31 paired samples","timestamp":1777130697523,"segment":13,"confidence":null,"iterationTokens":102,"asi":{"hypothesis":"Increase sample count from 21 to 31 to reduce benchmark noise before more sub-10us startup experiments.","benchmark_change":"CT_BENCH_SAMPLES default changed from 21 to 31; workload and primary delta_us remain otherwise unchanged.","baseline_delta_us":-92.008154,"guardrail_apply_delta_us":1.292185,"guardrail_command_us":56.3375,"next_action_hint":"Use this as new noise-reduced baseline; require repeated improvements for small code changes."}}
{"run":83,"commit":"94ce604","metric":-90.428906,"metrics":{"ct_startup_us":419.435449,"minimal_startup_us":498.647949,"startup_ratio_x":0.841145,"ct_resolve_us":0.043309,"minimal_resolve_us":0.083633,"resolve_delta_us":-0.040323,"ct_apply_us":561.219893,"minimal_apply_us":564.386252,"apply_delta_us":1.7076,"command_us":57.708496},"status":"discard","description":"Localize core autocmd API functions","timestamp":1777130742042,"segment":13,"confidence":null,"iterationTokens":2016,"asi":{"hypothesis":"Binding nvim_create_augroup, nvim_clear_autocmds, and nvim_create_autocmd to locals could reduce setup-time API lookup overhead.","rollback_reason":"Primary delta_us regressed slightly from -92.01us to -90.43us and command/apply guardrails also worsened. Top-level local bindings did not pay for themselves.","next_action_hint":"Keep direct vim.api autocmd calls in core; avoid further API-localization micro-opts."}}
{"run":84,"commit":"94ce604","metric":-84.466602,"metrics":{"ct_startup_us":417.270801,"minimal_startup_us":501.452002,"startup_ratio_x":0.832125,"ct_resolve_us":0.044915,"minimal_resolve_us":0.071415,"resolve_delta_us":-0.0265,"ct_apply_us":577.303435,"minimal_apply_us":575.875518,"apply_delta_us":3.071667,"command_us":58.2},"status":"discard","description":"Hoist focus autocmd callbacks and option tables","timestamp":1777130798328,"segment":13,"confidence":null,"iterationTokens":3520,"asi":{"hypothesis":"Reusing module-local focus callbacks and autocmd option tables should avoid per-setup closure/table allocation while preserving unconditional registration behavior.","rollback_reason":"Primary delta_us regressed from -92.01us to -84.47us and apply/command guardrails worsened. Extra top-level functions/tables outweighed setup allocation savings.","next_action_hint":"Keep inline focus autocmd callbacks/options in setup. Autocmd allocation hoisting is not worthwhile."}}
