{"run":43,"commit":"069ff93","metric":-84.239502,"metrics":{"ct_startup_us":411.239502,"minimal_startup_us":495.479004,"startup_ratio_x":0.829984,"ct_resolve_us":0.043757,"minimal_resolve_us":0.06011,"resolve_delta_us":-0.016353,"ct_apply_us":559.498542,"minimal_apply_us":554.010518,"apply_delta_us":5.516565,"command_us":58.421094},"status":"keep","description":"Baseline startup delta after command path exhausted under broadened benchmark","timestamp":1777127837560,"segment":7,"confidence":null,"iterationTokens":102,"asi":{"hypothesis":"Return primary target to setup/startup delta after command registration path became noise-limited, keeping apply and command metrics as guardrails.","benchmark_change":"Metric changed back to delta_us on the broadened four-scenario workload with stable command measurement still present.","baseline_delta_us":-84.239502,"guardrail_apply_delta_us":5.516565,"guardrail_command_us":58.421094,"next_action_hint":"Try low-risk setup copy improvements such as noref deepcopy; avoid repeating discarded shallow-copy/manual-merge rewrites."}}
{"run":44,"commit":"107881f","metric":-90.166504,"metrics":{"ct_startup_us":385.770996,"minimal_startup_us":475.9375,"startup_ratio_x":0.81055,"ct_resolve_us":0.050688,"minimal_resolve_us":0.08772,"resolve_delta_us":-0.037033,"ct_apply_us":565.484478,"minimal_apply_us":556.48573,"apply_delta_us":6.402292,"command_us":60.520801},"status":"keep","description":"Use noref deepcopy for setup config copies","timestamp":1777127875097,"segment":7,"confidence":null,"iterationTokens":3725,"asi":{"hypothesis":"Setup config tables are acyclic; passing noref=true to vim.deepcopy should reduce reference-tracking overhead for user opts and base config copies without changing observable config values.","result":"delta_us improved from -84.24us to -90.17us; startup ratio improved to 0.81 while apply and command guardrails remained acceptable.","tradeoff":"Shared-table identity inside configs is no longer preserved across deepcopy, which should not matter for Colorful Times config semantics. Tests passed.","next_action_hint":"Consider applying noref deepcopy to reload/base-config reset if it affects user-triggered reload, but primary startup path is covered."}}
{"run":45,"commit":"107881f","metric":56.718994,"metrics":{"ct_startup_us":529.239746,"minimal_startup_us":472.520752,"startup_ratio_x":1.120035,"ct_resolve_us":0.055933,"minimal_resolve_us":0.072196,"resolve_delta_us":-0.016263,"ct_apply_us":561.01625,"minimal_apply_us":558.352708,"apply_delta_us":5.90948,"command_us":61.654395},"status":"discard","description":"No-code confirmation rerun of noref deepcopy setup optimization","timestamp":1777127907983,"segment":7,"confidence":null,"iterationTokens":1488,"asi":{"hypothesis":"Confirm whether the noref deepcopy startup improvement is stable or noise.","rollback_reason":"No code change was made and delta_us reran much worse (+56.72us vs best -90.17us), indicating startup delta remains noisy in this segment.","next_action_hint":"Do not chase small delta_us changes without repeated confirmation or a structural reason. Consider increasing startup samples or using paired startup deltas like apply_delta_us."}}
{"type":"config","name":"Paired startup delta with hourly schedule coverage","metricName":"delta_us","metricUnit":"µs","bestDirection":"lower"}
{"run":46,"commit":"f169dfd","metric":-76.968262,"metrics":{"ct_startup_us":397,"minimal_startup_us":468.020508,"startup_ratio_x":0.848253,"ct_resolve_us":0.055097,"minimal_resolve_us":0.146757,"resolve_delta_us":-0.09166,"ct_apply_us":560.40323,"minimal_apply_us":557.111565,"apply_delta_us":-0.81615,"command_us":57.741699},"status":"keep","description":"Baseline paired startup delta benchmark after noref deepcopy optimization","timestamp":1777127968006,"segment":8,"confidence":null,"iterationTokens":102,"asi":{"hypothesis":"Pair Colorful Times and minimal startup samples before taking the median delta to reduce noise from independent startup medians.","benchmark_change":"delta_us is now median of paired per-sample startup deltas. Experiment reinitialized; prior delta_us values are not directly comparable.","baseline_delta_us":-76.968262,"guardrail_apply_delta_us":-0.81615,"guardrail_command_us":57.741699,"next_action_hint":"Retest noref deepcopy by reverting it under the paired benchmark, or look for structural setup wins larger than startup noise."}}
{"run":47,"commit":"5b1b614","metric":-107.458496,"metrics":{"ct_startup_us":396.281006,"minimal_startup_us":497.854248,"startup_ratio_x":0.795978,"ct_resolve_us":0.045432,"minimal_resolve_us":0.064991,"resolve_delta_us":-0.019559,"ct_apply_us":562.607188,"minimal_apply_us":559.27542,"apply_delta_us":4.540317,"command_us":63.341699},"status":"keep","description":"Revert noref deepcopy after paired startup benchmark showed regular deepcopy faster","timestamp":1777128004628,"segment":8,"confidence":null,"iterationTokens":1380,"asi":{"hypothesis":"The noref deepcopy improvement was likely noise under independent-median startup delta; paired startup benchmark should verify whether regular deepcopy or noref is actually better.","result":"Regular vim.deepcopy improved paired delta_us from -76.97us to -107.46us, so noref deepcopy was reverted.","tradeoff":"Command guardrail worsened to 63.34us but remains below the original command baseline; apply guardrail remains near parity.","next_action_hint":"Keep regular deepcopy in setup. Avoid noref deepcopy for startup unless a stronger repeated signal appears."}}
{"run":48,"commit":"5b1b614","metric":-80.833252,"metrics":{"ct_startup_us":424.020752,"minimal_startup_us":503.229248,"startup_ratio_x":0.8426,"ct_resolve_us":0.044857,"minimal_resolve_us":0.073656,"resolve_delta_us":-0.028799,"ct_apply_us":562.040105,"minimal_apply_us":556.72479,"apply_delta_us":3.967915,"command_us":58.858398},"status":"discard","description":"Cache core-local setup time validation results","timestamp":1777128053544,"segment":8,"confidence":null,"iterationTokens":2411,"asi":{"hypothesis":"The 24-entry scenario repeats time strings across start/stop fields; caching core-local validate_time results should reduce setup validation work without loading schedule.lua.","rollback_reason":"Primary paired delta_us worsened from -107.46us to -80.83us; cache table lookups and sentinel handling outweighed repeated parse savings.","next_action_hint":"Keep simple uncached core-local validate_time. Do not retry time-validation caching unless schedules are much larger and separately targeted."}}
{"run":49,"commit":"5b1b614","metric":-75.270752,"metrics":{"ct_startup_us":404.927246,"minimal_startup_us":484.551758,"startup_ratio_x":0.835674,"ct_resolve_us":0.049321,"minimal_resolve_us":0.069417,"resolve_delta_us":-0.020095,"ct_apply_us":559.96823,"minimal_apply_us":555.891462,"apply_delta_us":4.383438,"command_us":72.041406},"status":"discard","description":"Register FocusLost and FocusGained with one combined autocmd callback","timestamp":1777128103454,"segment":8,"confidence":null,"iterationTokens":2186,"asi":{"hypothesis":"Combining focus autocmd registration into one nvim_create_autocmd call may reduce setup API overhead while preserving events and behavior.","rollback_reason":"Primary paired delta_us worsened from -107.46us to -75.27us and command guardrail worsened; the combined callback/API form is slower here.","next_action_hint":"Keep separate FocusLost and FocusGained autocmds."}}
{"run":50,"commit":"5b1b614","metric":-98.0625,"metrics":{"ct_startup_us":411.239258,"minimal_startup_us":494.218506,"startup_ratio_x":0.8321,"ct_resolve_us":0.051801,"minimal_resolve_us":0.132427,"resolve_delta_us":-0.080626,"ct_apply_us":560.954167,"minimal_apply_us":559.20896,"apply_delta_us":3.499897,"command_us":58.200293},"status":"discard","description":"Add explicit setup wrapper in init.lua to avoid metatable __index on setup access","timestamp":1777128160290,"segment":8,"confidence":null,"iterationTokens":2545,"asi":{"hypothesis":"Defining a direct M.setup wrapper might avoid the __index metamethod lookup for the common setup call and reduce startup delta.","rollback_reason":"Primary paired delta_us worsened versus best (-107.46us to -98.06us); wrapper call overhead outweighed avoiding __index.","next_action_hint":"Keep metatable lazy loading for setup. Do not add explicit wrappers unless targeting a different workload."}}
{"run":51,"commit":"5b1b614","metric":-75.1875,"metrics":{"ct_startup_us":414.468994,"minimal_startup_us":478.208252,"startup_ratio_x":0.866712,"ct_resolve_us":0.045639,"minimal_resolve_us":0.079899,"resolve_delta_us":-0.034261,"ct_apply_us":561.067085,"minimal_apply_us":556.639688,"apply_delta_us":5.131458,"command_us":57.491699},"status":"discard","description":"Unroll default theme validation and remove THEME_KEYS table from core","timestamp":1777128218495,"segment":8,"confidence":null,"iterationTokens":2425,"asi":{"hypothesis":"Validation checks only light and dark theme overrides; unrolling avoids ipairs and a core-local THEME_KEYS allocation during setup.","rollback_reason":"Primary paired delta_us worsened from -107.46us to -75.19us; the unrolled code did not help and reduced maintainability.","next_action_hint":"Keep THEME_KEYS loop in core validation."}}
{"run":52,"commit":"5b1b614","metric":-80.01001,"metrics":{"ct_startup_us":414.062256,"minimal_startup_us":496.625,"startup_ratio_x":0.833752,"ct_resolve_us":0.047858,"minimal_resolve_us":0.068921,"resolve_delta_us":-0.021064,"ct_apply_us":562.4025,"minimal_apply_us":557.788125,"apply_delta_us":-0.153123,"command_us":60.3},"status":"discard","description":"No-code confirmation rerun of paired startup best state after discarded micro-optimizations","timestamp":1777128272708,"segment":8,"confidence":null,"iterationTokens":1833,"asi":{"hypothesis":"Confirm current paired startup best after multiple discarded startup micro-optimizations.","rollback_reason":"No production change was made and delta_us reran worse than best -107.46us, though still faster than the minimal switcher baseline.","next_action_hint":"Startup delta remains noisy around parity. Avoid keeping micro-optimizations unless they repeatedly beat the current code or improve code simplicity."}}
{"run":53,"commit":"5b1b614","metric":-96.072998,"metrics":{"ct_startup_us":391.625,"minimal_startup_us":497.322754,"startup_ratio_x":0.787466,"ct_resolve_us":0.045467,"minimal_resolve_us":0.075124,"resolve_delta_us":-0.029657,"ct_apply_us":559.255833,"minimal_apply_us":557.47854,"apply_delta_us":4.831353,"command_us":60.466699},"status":"discard","description":"Replace lazy-key lookup table with inline string comparisons","timestamp":1777128314084,"segment":8,"confidence":null,"iterationTokens":1728,"asi":{"hypothesis":"Avoiding the lazy-key table allocation in init.lua might reduce module startup cost while setup key checks short-circuit early.","rollback_reason":"Primary paired delta_us worsened versus best (-107.46us to -96.07us), and the inline comparisons are less maintainable than the lookup table.","next_action_hint":"Keep the _lazy_keys table."}}
{"run":54,"commit":"5b1b614","metric":-76.604248,"metrics":{"ct_startup_us":411.104248,"minimal_startup_us":504.197754,"startup_ratio_x":0.815363,"ct_resolve_us":0.051849,"minimal_resolve_us":0.077001,"resolve_delta_us":-0.025152,"ct_apply_us":563.644063,"minimal_apply_us":561.60667,"apply_delta_us":1.541665,"command_us":59.1125},"status":"discard","description":"Use package.loaded fallback before requiring public module in core.lua","timestamp":1777128385288,"segment":8,"confidence":null,"iterationTokens":4166,"asi":{"hypothesis":"core.lua is usually loaded from init.lua after the public module is already in package.loaded; checking package.loaded first might avoid require overhead.","rollback_reason":"Primary paired delta_us worsened from -107.46us to -76.60us; the package.loaded branch added overhead and was less clear.","next_action_hint":"Keep direct require('colorful-times') in core.lua."}}
{"run":55,"commit":"5b1b614","metric":-75.677734,"metrics":{"ct_startup_us":399.489502,"minimal_startup_us":487.062256,"startup_ratio_x":0.820202,"ct_resolve_us":0.044429,"minimal_resolve_us":0.073965,"resolve_delta_us":-0.029536,"ct_apply_us":556.399063,"minimal_apply_us":555.699792,"apply_delta_us":2.17146,"command_us":56.908301},"status":"discard","description":"Skip clearing ColorfulTimes autocmd group on first setup after module-load clear","timestamp":1777128543463,"segment":8,"confidence":null,"iterationTokens":12000,"asi":{"hypothesis":"core.lua already creates the ColorfulTimes augroup with clear=true at module load, so the first setup can skip nvim_clear_autocmds and only clear on later setup calls.","rollback_reason":"Primary paired delta_us worsened from current best -107.46us to -75.68us. The extra state branch outweighed skipping the clear call and slightly changed edge-case behavior.","next_action_hint":"Keep unconditional setup-time nvim_clear_autocmds."}}
{"run":56,"commit":"5b1b614","metric":-94.54126,"metrics":{"ct_startup_us":398.343506,"minimal_startup_us":469.239502,"startup_ratio_x":0.848913,"ct_resolve_us":0.049143,"minimal_resolve_us":0.133978,"resolve_delta_us":-0.084835,"ct_apply_us":554.818018,"minimal_apply_us":551.561145,"apply_delta_us":2.82021,"command_us":57.695801},"status":"discard","description":"Skip deferred setup callback when persist=false and plugin starts disabled","timestamp":1777128593282,"segment":8,"confidence":null,"iterationTokens":1530,"asi":{"hypothesis":"For persist=false and enabled=false, deferred setup callback only calls load_persisted_state and returns; skipping it should preserve behavior and reduce disabled-scenario setup cost.","rollback_reason":"Primary paired delta_us worsened versus best (-107.46us to -94.54us); branch and behavior split did not pay off in the four-scenario benchmark.","next_action_hint":"Keep unconditional defer setup path for simpler behavior."}}
{"run":57,"commit":"5b1b614","metric":-94.979492,"metrics":{"ct_startup_us":390.614502,"minimal_startup_us":488.676758,"startup_ratio_x":0.799331,"ct_resolve_us":0.048224,"minimal_resolve_us":0.067455,"resolve_delta_us":-0.019231,"ct_apply_us":561.694478,"minimal_apply_us":560.939167,"apply_delta_us":5.971458,"command_us":62.504102},"status":"discard","description":"Remove explicit nil defaults from public config table","timestamp":1777128642020,"segment":8,"confidence":null,"iterationTokens":1921,"asi":{"hypothesis":"Explicit nil fields in init.lua default config are not observable in Lua tables; removing them and using an empty themes table should reduce table construction/parser work without changing behavior.","rollback_reason":"Primary paired delta_us worsened versus best (-107.46us to -94.98us). The source simplification did not improve the active metric.","next_action_hint":"Keep explicit nil defaults for readability/documentation."}}
{"type":"config","name":"Stable paired startup delta with hourly schedule coverage","metricName":"delta_us","metricUnit":"µs","bestDirection":"lower"}
{"run":58,"commit":"2412bd4","metric":-76.885498,"metrics":{"ct_startup_us":413.666602,"minimal_startup_us":492.551953,"startup_ratio_x":0.839844,"ct_resolve_us":0.046826,"minimal_resolve_us":0.077601,"resolve_delta_us":-0.030775,"ct_apply_us":568.33729,"minimal_apply_us":561.955625,"apply_delta_us":-0.400835,"command_us":66.537402},"status":"keep","description":"Baseline stable paired startup benchmark with five startup cycles per sample","timestamp":1777128759602,"segment":9,"confidence":null,"iterationTokens":102,"asi":{"hypothesis":"Average five startup cycles per sample before paired delta_us calculation to reduce startup measurement noise while keeping the benchmark fair to both implementations.","benchmark_change":"Metric implementation changed; delta_us still measures paired startup/setup difference across the same four scenarios, now with CT_BENCH_STARTUP_ITERS=5.","baseline_delta_us":-76.885498,"guardrail_apply_delta_us":-0.400835,"guardrail_command_us":66.537402,"next_action_hint":"Retest structural startup ideas under the stabler benchmark; ignore tiny wins under roughly 5-10us."}}
{"run":59,"commit":"e026a95","metric":-83.797803,"metrics":{"ct_startup_us":419.220703,"minimal_startup_us":504.208301,"startup_ratio_x":0.831443,"ct_resolve_us":0.046016,"minimal_resolve_us":0.071657,"resolve_delta_us":-0.025641,"ct_apply_us":573.740522,"minimal_apply_us":571.181042,"apply_delta_us":4.99156,"command_us":60.075},"status":"keep","description":"Retest noref deepcopy under stable paired startup benchmark","timestamp":1777128801590,"segment":9,"confidence":null,"iterationTokens":1338,"asi":{"hypothesis":"With startup noise reduced by five startup cycles per sample, noref deepcopy may show a clearer signal for setup config copies.","result":"delta_us improved from -76.89us to -83.80us under the stable paired startup benchmark.","tradeoff":"Config table reference identity is not preserved inside copied configs; Colorful Times config semantics should not depend on shared subtable identity. Tests passed.","next_action_hint":"Run a no-code confirmation before stacking more micro-optimizations; improvement is about 6.9us, near the ignore-tiny-wins threshold."}}
{"run":60,"commit":"ca17471","metric":-84.797754,"metrics":{"ct_startup_us":429.950049,"minimal_startup_us":508.166748,"startup_ratio_x":0.846081,"ct_resolve_us":0.043786,"minimal_resolve_us":0.069153,"resolve_delta_us":-0.025367,"ct_apply_us":585.62354,"minimal_apply_us":570.52448,"apply_delta_us":5.04218,"command_us":60.616699},"status":"keep","description":"No-code confirmation of noref deepcopy under stable paired startup benchmark","timestamp":1777128835776,"segment":9,"confidence":null,"iterationTokens":1038,"asi":{"hypothesis":"Confirm the noref deepcopy startup improvement before stacking more changes because the first stable run improved by only ~6.9us.","result":"Confirmation produced delta_us=-84.80us, close to the prior -83.80us and still better than baseline -76.89us; improvement appears real enough to keep.","tradeoff":"No code change this run; keeps existing noref deepcopy commit. Apply guardrail is slower but still near parity; command guardrail remains better than original command baseline.","next_action_hint":"Look for similarly structural setup reductions larger than ~5us; avoid pure lookup micro-optimizations already tried."}}
{"run":61,"commit":"86491a2","metric":-90.752197,"metrics":{"ct_startup_us":412.179248,"minimal_startup_us":508.345801,"startup_ratio_x":0.810825,"ct_resolve_us":0.045165,"minimal_resolve_us":0.089736,"resolve_delta_us":-0.044572,"ct_apply_us":604.755208,"minimal_apply_us":601.351665,"apply_delta_us":8.72802,"command_us":59.391992},"status":"keep","description":"Use noref deepcopy only for user opts while keeping base config deepcopy regular","timestamp":1777128883852,"segment":9,"confidence":null,"iterationTokens":6639,"asi":{"hypothesis":"The setup user opts copy may benefit from noref, while the already-normalized base config copy may be faster or safer with regular deepcopy.","result":"delta_us improved from confirmed noref-both best -84.80us to -90.75us. This suggests noref is useful for user opts but not for base config.","tradeoff":"Base config copy preserves reference identity again; opts copy still assumes user config identity does not matter after setup. Apply guardrail worsened but remains near parity.","next_action_hint":"Confirm this split-copy choice before keeping more changes, then test the opposite split only if needed."}}
{"run":62,"commit":"86491a2","metric":-77.562451,"metrics":{"ct_startup_us":413.285352,"minimal_startup_us":487.179248,"startup_ratio_x":0.848323,"ct_resolve_us":0.043049,"minimal_resolve_us":0.065284,"resolve_delta_us":-0.022235,"ct_apply_us":568.356353,"minimal_apply_us":569.72094,"apply_delta_us":5.2074,"command_us":60.825},"status":"discard","description":"No-code confirmation of noref opts-only deepcopy split","timestamp":1777128911482,"segment":9,"confidence":null,"iterationTokens":1065,"asi":{"hypothesis":"Confirm opts-only noref deepcopy improvement before stacking more changes.","rollback_reason":"No code change was made and delta_us reran near baseline (-77.56us vs previous -90.75us), so the opts-only split improvement is likely noisy.","next_action_hint":"Treat noref split choices as noise-prone. Do not stack further deepcopy micro changes without stronger repeated evidence."}}
{"run":63,"commit":"86491a2","metric":-77.650049,"metrics":{"ct_startup_us":427.90625,"minimal_startup_us":499.124951,"startup_ratio_x":0.857313,"ct_resolve_us":0.043954,"minimal_resolve_us":0.066441,"resolve_delta_us":-0.022487,"ct_apply_us":558.343647,"minimal_apply_us":553.040938,"apply_delta_us":7.027915,"command_us":57.624805},"status":"discard","description":"Revert opts noref deepcopy to regular deepcopy after noisy confirmation","timestamp":1777128960698,"segment":9,"confidence":null,"iterationTokens":1454,"asi":{"hypothesis":"If opts-only noref was noise, regular deepcopy should be as good or better under the stable paired startup benchmark and safer for preserving reference identity.","rollback_reason":"Regular deepcopy also measured near baseline and did not improve primary delta_us versus the noref opts-only commit's best run, so this revert was not kept.","next_action_hint":"Current code still has opts-only noref deepcopy. Consider reverting it later only for maintainability if performance target is already satisfied."}}
