{"type":"config","name":"Match minimal colorscheme switcher speed","metricName":"delta_us","metricUnit":"µs","bestDirection":"lower"}
{"run":1,"commit":"7632eb1","metric":460.916992,"metrics":{"ct_startup_us":931.777995,"minimal_startup_us":470.861003,"startup_ratio_x":1.978881,"ct_resolve_us":0.023554,"minimal_resolve_us":0.064983,"resolve_delta_us":-0.041429,"ct_apply_us":576.1757,"minimal_apply_us":563.5361,"apply_delta_us":12.6396,"command_us":60.125},"status":"keep","description":"Baseline: compare Colorful Times startup/setup against under-50-LOC minimal switcher across three scenarios","timestamp":1777125762442,"segment":0,"confidence":null,"iterationTokens":118,"asi":{"hypothesis":"Establish fair baseline for startup/setup delta versus a minimal schedule-aware colorscheme switcher; no production optimization yet.","benchmark_design":"Primary uses cleared-module require plus setup for empty, two-entry, and disabled scenarios; persist=false and isolated XDG avoid user-state effects.","baseline_delta_us":460.916992,"baseline_ratio_x":1.978881,"next_action_hint":"Inspect setup path costs: lazy core require, validation, deepcopy/base config copy, autocmd registration, and command registration."}}
{"run":2,"commit":"d68272b","metric":41.138672,"metrics":{"ct_startup_us":509.888672,"minimal_startup_us":468.75,"startup_ratio_x":1.087762,"ct_resolve_us":0.025707,"minimal_resolve_us":0.070754,"resolve_delta_us":-0.045047,"ct_apply_us":587.109017,"minimal_apply_us":567.446533,"apply_delta_us":19.662484,"command_us":59.75},"status":"keep","description":"Lazy-load state and system modules from core to avoid unnecessary setup-time requires","timestamp":1777125832182,"segment":0,"confidence":null,"iterationTokens":10311,"asi":{"hypothesis":"Core setup with persist=false and non-system backgrounds does not need state.lua or system.lua at require time; lazy getters should cut startup delta without changing behavior.","result":"Primary delta dropped from 460.9us to 41.1us; Colorful Times setup is about 1.09x the minimal switcher in this benchmark.","tradeoff":"Runtime calls that actually need persistence or system detection now pay one cached function call plus first require at point of use; tests passed.","next_action_hint":"Remaining delta likely comes from schedule.lua eager require, validation, base config deepcopy, and autocmd/defer setup. Explore simple no-op reductions only."}}
{"run":3,"commit":"5c52eef","metric":-12.027344,"metrics":{"ct_startup_us":452.652669,"minimal_startup_us":464.680013,"startup_ratio_x":0.974117,"ct_resolve_us":0.034978,"minimal_resolve_us":0.067985,"resolve_delta_us":-0.033007,"ct_apply_us":584.299316,"minimal_apply_us":587.487516,"apply_delta_us":-3.1882,"command_us":62.791016},"status":"keep","description":"Lazy-load schedule module and only require it when validation or runtime schedule resolution needs it","timestamp":1777125911859,"segment":0,"confidence":null,"iterationTokens":6844,"asi":{"hypothesis":"Schedule.lua is not needed for empty-schedule setup and can be required on first validation/resolution, cutting average setup cost across mixed scenarios.","result":"Primary delta improved from 41.1us to -12.0us; benchmark now shows Colorful Times setup at about 0.97x minimal reference speed, within likely noise.","tradeoff":"Hot resolution path adds one cached schedule() getter call; secondary resolve/apply metrics remain comparable and checks passed.","next_action_hint":"Rerun current state for noise confidence before deeper changes; remaining differences likely below benchmark noise floor."}}
{"run":4,"commit":"f20f29a","metric":-22.083659,"metrics":{"ct_startup_us":425.472331,"minimal_startup_us":447.55599,"startup_ratio_x":0.950657,"ct_resolve_us":0.037062,"minimal_resolve_us":0.064146,"resolve_delta_us":-0.027083,"ct_apply_us":576.874316,"minimal_apply_us":585.002767,"apply_delta_us":-8.128451,"command_us":66.833008},"status":"keep","description":"Cache lazy schedule module in validation loop instead of calling getter for every schedule entry","timestamp":1777125936201,"segment":0,"confidence":null,"iterationTokens":1817,"asi":{"hypothesis":"After lazy-loading schedule.lua, validation of non-empty schedules should cache the module in a local so each entry does not pay a getter call.","result":"Metric improved from -12.0us to -22.1us, though likely near noise floor; code simplification is still low risk.","tradeoff":"No behavior change; local cache only affects validation loop. Checks passed.","next_action_hint":"Further startup gains may be noise. Consider improving benchmark confidence or targeting command registration only if it remains measurable."}}
{"run":5,"commit":"f20f29a","metric":-3.222005,"metrics":{"ct_startup_us":474.18099,"minimal_startup_us":477.402995,"startup_ratio_x":0.993251,"ct_resolve_us":0.026261,"minimal_resolve_us":0.071667,"resolve_delta_us":-0.045406,"ct_apply_us":591.381234,"minimal_apply_us":575.85695,"apply_delta_us":15.524284,"command_us":65.625},"status":"discard","description":"Store parsed start/stop locals inside schedule.validate_entry to avoid repeated parse_time calls","timestamp":1777125969959,"segment":0,"confidence":null,"iterationTokens":2914,"asi":{"hypothesis":"Avoiding repeated parse_time calls in validate_entry should reduce setup cost for non-empty schedules.","rollback_reason":"Primary delta worsened versus current best (-22.08us to -3.22us), likely because extra branching/locals outweighed cached parse_time savings under LuaJIT/noisy microbenchmarks.","next_action_hint":"Do not retry this exact validate_entry rewrite; repeated parse_time calls are already cheap due _time_cache."}}
{"run":6,"commit":"f20f29a","metric":25.916341,"metrics":{"ct_startup_us":473.472005,"minimal_startup_us":447.555664,"startup_ratio_x":1.057906,"ct_resolve_us":0.033654,"minimal_resolve_us":0.069382,"resolve_delta_us":-0.035728,"ct_apply_us":574.540967,"minimal_apply_us":575.509717,"apply_delta_us":-0.96875,"command_us":67.458008},"status":"discard","description":"Replace vim.tbl_deep_extend default merge with manual field assignment","timestamp":1777126033179,"segment":0,"confidence":27.57648089507448,"iterationTokens":2914,"asi":{"hypothesis":"Manual default merge might avoid vim.tbl_deep_extend overhead in setup.","rollback_reason":"Primary delta regressed from -22.08us to +25.92us and the change narrowed supported merge behavior for unknown default keys.","next_action_hint":"Keep vim.tbl_deep_extend for default config; C-side/helper overhead is not the bottleneck here."}}
{"run":7,"commit":"f20f29a","metric":228.875,"metrics":{"ct_startup_us":679.388997,"minimal_startup_us":450.513997,"startup_ratio_x":1.508031,"ct_resolve_us":0.030899,"minimal_resolve_us":0.072304,"resolve_delta_us":-0.041406,"ct_apply_us":610.275,"minimal_apply_us":592.695833,"apply_delta_us":17.579167,"command_us":63},"status":"discard","description":"Create ColorfulTimes augroup lazily in setup to avoid module-load augroup work","timestamp":1777126068441,"segment":0,"confidence":4.136589412526617,"iterationTokens":2230,"asi":{"hypothesis":"Moving augroup creation from core module load into setup and avoiding the first extra clear_autocmds call might reduce setup cost.","rollback_reason":"Primary delta regressed badly from -22.08us to +228.88us; moving augroup work into setup appears slower under the measured path or disrupts autocmd caching.","next_action_hint":"Do not lazily create the augroup. Keep existing top-level create_augroup plus setup clear_autocmds pattern."}}
{"run":8,"commit":"f20f29a","metric":6.930664,"metrics":{"ct_startup_us":446.125,"minimal_startup_us":439.194336,"startup_ratio_x":1.01578,"ct_resolve_us":0.034147,"minimal_resolve_us":0.062381,"resolve_delta_us":-0.028233,"ct_apply_us":592.689583,"minimal_apply_us":603.840967,"apply_delta_us":-11.151383,"command_us":61.583984},"status":"discard","description":"Cache vim.api in core for augroup and autocmd setup calls","timestamp":1777126123596,"segment":0,"confidence":12.271346522135987,"iterationTokens":5590,"asi":{"hypothesis":"Localizing vim.api might reduce global/table lookup overhead during setup autocmd registration.","rollback_reason":"Primary delta worsened versus best (-22.08us to +6.93us); global lookup overhead is not material, and added local did not help.","next_action_hint":"Avoid micro-localizing vim.api for this path; benchmark noise plus extra local can offset any lookup savings."}}
{"run":9,"commit":"6b3d643","metric":-75.263672,"metrics":{"ct_startup_us":378.569661,"minimal_startup_us":453.833333,"startup_ratio_x":0.83416,"ct_resolve_us":0.039749,"minimal_resolve_us":0.062841,"resolve_delta_us":-0.023092,"ct_apply_us":587.80415,"minimal_apply_us":581.096517,"apply_delta_us":6.707633,"command_us":65.75},"status":"keep","description":"Validate setup schedules with a lightweight core-local validator to avoid loading schedule.lua at startup","timestamp":1777126162340,"segment":0,"confidence":12.271346522135987,"iterationTokens":2619,"asi":{"hypothesis":"Setup only needs validation, not schedule preprocessing; a small core-local validator can preserve synchronous config errors while deferring schedule.lua load to deferred runtime work.","result":"Primary delta improved from -22.08us to -75.26us; Colorful Times setup measured about 0.83x the minimal switcher.","tradeoff":"Validation rules are now mirrored in core and schedule.lua, so future schedule validation changes must keep both paths aligned. Tests passed.","next_action_hint":"Add targeted regression tests if validation rules change; next explore whether benchmark/docs need note about duplicated setup validator."}}
{"run":10,"commit":"6b3d643","metric":-60.694336,"metrics":{"ct_startup_us":434.263997,"minimal_startup_us":494.958333,"startup_ratio_x":0.877375,"ct_resolve_us":0.031013,"minimal_resolve_us":0.063077,"resolve_delta_us":-0.032065,"ct_apply_us":627.30835,"minimal_apply_us":642.631266,"apply_delta_us":-15.322917,"command_us":59.833008},"status":"discard","description":"Localize nvim_create_user_command in plugin command registration","timestamp":1777126249409,"segment":0,"confidence":12.271346522135987,"iterationTokens":5749,"asi":{"hypothesis":"Caching vim.api.nvim_create_user_command as a local should reduce plugin command registration cost.","rollback_reason":"Although command_us improved versus recent runs, primary delta worsened from -75.26us to -60.69us, and primary metric remains the optimization target.","next_action_hint":"Command registration is not worth changing unless primary includes plugin/ startup; keep explicit command registration for now."}}
{"type":"config","name":"Match minimal colorscheme switcher apply speed","metricName":"apply_delta_us","metricUnit":"µs","bestDirection":"lower"}
{"run":11,"commit":"c4890e1","metric":17.7632,"metrics":{"delta_us":-107.152669,"ct_startup_us":374.152995,"minimal_startup_us":481.305664,"startup_ratio_x":0.777371,"ct_resolve_us":0.034736,"minimal_resolve_us":0.071601,"resolve_delta_us":-0.036865,"ct_apply_us":605.136816,"minimal_apply_us":587.373617,"command_us":61.583984},"status":"keep","description":"Baseline for apply/switch parity after setup startup reached minimal-switcher speed","timestamp":1777126320911,"segment":1,"confidence":null,"iterationTokens":112,"asi":{"hypothesis":"Reset target to actual apply/switch cost now that startup/setup delta is below the minimal switcher baseline.","baseline_apply_delta_us":17.7632,"startup_guardrail_delta_us":-107.152669,"next_action_hint":"Inspect apply_colorscheme and resolve_theme_context for work not present in minimal apply, especially scheduling, default override resolution, and first schedule preprocess."}}
{"run":12,"commit":"4077782","metric":4.365283,"metrics":{"delta_us":-94.486003,"ct_startup_us":375.388997,"minimal_startup_us":469.875,"startup_ratio_x":0.798912,"ct_resolve_us":0.029872,"minimal_resolve_us":0.069644,"resolve_delta_us":-0.039773,"ct_apply_us":578.435417,"minimal_apply_us":574.070133,"command_us":62},"status":"keep","description":"Resolve hot apply path into scalar values to avoid allocating context tables on every switch","timestamp":1777126353002,"segment":1,"confidence":null,"iterationTokens":3625,"asi":{"hypothesis":"apply_colorscheme only needs scalar resolution fields; building a context table each call adds overhead not present in the minimal switcher.","result":"apply_delta_us improved from 17.76us to 4.37us while startup guardrail stayed faster than minimal (delta_us=-94.49us).","tradeoff":"resolve_theme_context still returns the public table by wrapping scalar resolution; pinned path still deepcopies session_pin only for context callers.","next_action_hint":"Remaining apply delta is small. Inspect schedule preprocessing on first apply and closure allocation from vim.schedule."}}
{"run":13,"commit":"5e8f7d7","metric":-11.345133,"metrics":{"delta_us":-112.013997,"ct_startup_us":355.319336,"minimal_startup_us":467.333333,"startup_ratio_x":0.760312,"ct_resolve_us":0.035256,"minimal_resolve_us":0.065516,"resolve_delta_us":-0.03026,"ct_apply_us":591.04445,"minimal_apply_us":602.389583,"command_us":71.666992},"status":"keep","description":"Apply colorschemes synchronously outside fast events while preserving scheduled fast-event safety","timestamp":1777126395762,"segment":1,"confidence":null,"iterationTokens":2903,"asi":{"hypothesis":"vim.schedule closure allocation adds overhead for normal main-thread apply calls; only fast-event/async contexts require scheduling.","result":"apply_delta_us improved from 4.37us to -11.35us; startup guardrail also stayed faster than minimal.","tradeoff":"Public apply now performs immediate Vim API work when not in a fast event. Fast-event callers still go through vim.schedule, satisfying async safety rules.","next_action_hint":"Verify no user-facing docs promise asynchronous apply semantics. Future apply optimizations should avoid weakening fast-event safety."}}
{"run":14,"commit":"5e8f7d7","metric":21.918734,"metrics":{"delta_us":-201.25,"ct_startup_us":382.111003,"minimal_startup_us":583.361003,"startup_ratio_x":0.655016,"ct_resolve_us":0.03949,"minimal_resolve_us":0.063535,"resolve_delta_us":-0.024046,"ct_apply_us":611.05555,"minimal_apply_us":589.136816,"command_us":67.5},"status":"discard","description":"Cache vim.in_fast_event in a local for apply_when_safe","timestamp":1777126429358,"segment":1,"confidence":3.2241143978126527,"iterationTokens":4138,"asi":{"hypothesis":"Localizing vim.in_fast_event should reduce repeated global lookup cost in apply_when_safe.","rollback_reason":"Primary apply_delta_us regressed from -11.35us to +21.92us; lookup localization was not beneficial in this noisy hot path.","next_action_hint":"Keep direct vim.in_fast_event access; avoid micro-localizing Vim globals without stronger evidence."}}
{"run":15,"commit":"5e8f7d7","metric":7.67985,"metrics":{"delta_us":-64.430664,"ct_startup_us":393.638997,"minimal_startup_us":458.069661,"startup_ratio_x":0.859343,"ct_resolve_us":0.029424,"minimal_resolve_us":0.063097,"resolve_delta_us":-0.033673,"ct_apply_us":586.077767,"minimal_apply_us":578.397917,"command_us":59.833008},"status":"discard","description":"Assume Neovim vim.in_fast_event exists and remove nil guard in apply_when_safe","timestamp":1777126448705,"segment":1,"confidence":2,"iterationTokens":1133,"asi":{"hypothesis":"Neovim >=0.12 always has vim.in_fast_event, so removing the existence guard might shrink apply_when_safe overhead.","rollback_reason":"Primary apply_delta_us worsened from -11.35us to +7.68us; the extra guard is not the bottleneck and may be optimized well already.","next_action_hint":"Leave the compatibility guard in place."}}
{"run":16,"commit":"5e8f7d7","metric":13.908333,"metrics":{"delta_us":-108.777995,"ct_startup_us":379.638672,"minimal_startup_us":488.416667,"startup_ratio_x":0.777284,"ct_resolve_us":0.049632,"minimal_resolve_us":0.137789,"resolve_delta_us":-0.088157,"ct_apply_us":626.972217,"minimal_apply_us":613.063883,"command_us":62.291992},"status":"discard","description":"Inline apply_when_safe logic in the common non-system apply branch","timestamp":1777126488926,"segment":1,"confidence":2.1510722594891885,"iterationTokens":2344,"asi":{"hypothesis":"Inlining the helper in the common non-system branch should avoid one Lua function call per apply.","rollback_reason":"Primary apply_delta_us regressed from -11.35us to +13.91us; duplicated branch code was slower under the benchmark.","next_action_hint":"Keep the apply_when_safe helper; LuaJIT likely handles the local function better than duplicated conditional code."}}
{"run":17,"commit":"5e8f7d7","metric":14.708301,"metrics":{"delta_us":-6.666667,"ct_startup_us":481.361328,"minimal_startup_us":488.027995,"startup_ratio_x":0.98634,"ct_resolve_us":0.039938,"minimal_resolve_us":0.069753,"resolve_delta_us":-0.029815,"ct_apply_us":605.6354,"minimal_apply_us":590.9271,"command_us":59.666016},"status":"discard","description":"Cache cfg.default in local variables inside scalar theme resolution","timestamp":1777126509738,"segment":1,"confidence":2.6574336901922475,"iterationTokens":1559,"asi":{"hypothesis":"Localizing cfg.default should reduce repeated table indexing in default and disabled resolution paths.","rollback_reason":"Primary apply_delta_us regressed from -11.35us to +14.71us and startup guardrail weakened; extra locals did not help.","next_action_hint":"Avoid table-index micro-optimizations in resolve_theme_parts unless profiling shows a clear hotspot."}}
{"run":18,"commit":"5e8f7d7","metric":1.833317,"metrics":{"delta_us":-72.819336,"ct_startup_us":395.680664,"minimal_startup_us":468.5,"startup_ratio_x":0.844569,"ct_resolve_us":0.027669,"minimal_resolve_us":0.064628,"resolve_delta_us":-0.036959,"ct_apply_us":607.344434,"minimal_apply_us":605.511117,"command_us":62.5},"status":"discard","description":"Skip schedule module lookup when enabled config has an empty schedule","timestamp":1777126577561,"segment":1,"confidence":2.1510722594891885,"iterationTokens":5479,"asi":{"hypothesis":"Empty schedules can resolve directly to defaults without loading or consulting schedule.lua, reducing apply/resolve work for common configs.","rollback_reason":"Primary apply_delta_us improved versus segment baseline but worsened versus current best (-11.35us to +1.83us); under the apply target, this is not worth keeping now.","next_action_hint":"The empty-schedule fast path may be worth revisiting if benchmark separates cold first-apply from steady-state apply, but do not retry unchanged."}}
{"run":19,"commit":"5e8f7d7","metric":18.048633,"metrics":{"delta_us":-76.472331,"ct_startup_us":381.999674,"minimal_startup_us":458.472005,"startup_ratio_x":0.833202,"ct_resolve_us":0.02558,"minimal_resolve_us":0.05046,"resolve_delta_us":-0.02488,"ct_apply_us":604.6382,"minimal_apply_us":586.589567,"command_us":58.791992},"status":"discard","description":"No-code confirmation rerun of current apply-speed best state","timestamp":1777126601251,"segment":1,"confidence":2.584279562992109,"iterationTokens":1528,"asi":{"hypothesis":"Measure noise in the current best apply-speed state before trying more micro-optimizations.","rollback_reason":"No production change was made and apply_delta_us reran much worse than the current best; the apply benchmark is noisy near parity.","next_action_hint":"Treat small apply_delta_us wins cautiously. Prefer structural improvements or repeated confirmation before keeping micro-optimizations."}}
{"run":20,"commit":"5e8f7d7","metric":11.770866,"metrics":{"delta_us":-90.930013,"ct_startup_us":369.791992,"minimal_startup_us":460.722005,"startup_ratio_x":0.802636,"ct_resolve_us":0.029072,"minimal_resolve_us":0.069603,"resolve_delta_us":-0.040531,"ct_apply_us":569.354183,"minimal_apply_us":557.583317,"command_us":57.5},"status":"discard","description":"Revert apply_when_safe to always schedule as an A/B check against synchronous safe apply","timestamp":1777126629259,"segment":1,"confidence":3.235977344636864,"iterationTokens":1660,"asi":{"hypothesis":"A/B check whether synchronous safe apply was a noisy win by reverting to unconditional vim.schedule.","rollback_reason":"apply_delta_us=11.77us is worse than the synchronous safe-apply best (-11.35us), so keep the current apply_when_safe behavior despite benchmark noise.","next_action_hint":"If apply noise remains high, increase apply iterations or split cold/steady-state metrics before making more micro changes."}}
{"type":"config","name":"Match minimal colorscheme switcher stable apply speed","metricName":"apply_delta_us","metricUnit":"µs","bestDirection":"lower"}
{"run":21,"commit":"57dd62e","metric":18.80403,"metrics":{"delta_us":-123.208659,"ct_startup_us":355.513672,"minimal_startup_us":478.722331,"startup_ratio_x":0.74263,"ct_resolve_us":0.04084,"minimal_resolve_us":0.050296,"resolve_delta_us":-0.009456,"ct_apply_us":565.927503,"minimal_apply_us":547.123473,"command_us":57.125},"status":"keep","description":"Baseline for stable apply benchmark with higher apply iteration count","timestamp":1777126671513,"segment":2,"confidence":null,"iterationTokens":104,"asi":{"hypothesis":"Increase apply iterations from 20 to 100 and reduce samples from 31 to 21 to lower apply_delta_us noise while keeping iteration time under 10s.","benchmark_change":"Workload changed, so experiment was reinitialized. Metrics are not directly comparable to the previous apply segment.","baseline_apply_delta_us":18.80403,"startup_guardrail_delta_us":-123.208659,"next_action_hint":"Re-test structural apply changes under the stabler apply benchmark; avoid keeping micro wins without confirmation."}}
