{"run":85,"commit":"2045954","metric":-104.99165,"metrics":{"ct_startup_us":447.050049,"minimal_startup_us":555.8521,"startup_ratio_x":0.804261,"ct_resolve_us":0.054328,"minimal_resolve_us":0.096798,"resolve_delta_us":-0.042471,"ct_apply_us":579.564375,"minimal_apply_us":580.955208,"apply_delta_us":1.150625,"command_us":61.554199},"status":"keep","description":"Hoist deferred setup callback into module-local function","timestamp":1777130857523,"segment":13,"confidence":null,"iterationTokens":4613,"asi":{"hypothesis":"Setup always schedules the same deferred startup work; passing a module-local function to vim.defer_fn avoids allocating a fresh closure per setup without deferring additional required work.","result":"delta_us improved from -92.01us to -104.99us under 31 samples. Apply guardrail was stable/slightly better; command_us worsened to 61.55us and needs monitoring.","tradeoff":"Moves deferred setup body out of M.setup, but behavior stays synchronous-equivalent except for reusing the function object.","next_action_hint":"Run no-code confirmation; keep only if delta improvement repeats and command regression stays acceptable."}}
{"run":86,"commit":"2045954","metric":-69.335498,"metrics":{"ct_startup_us":420.068799,"minimal_startup_us":489.431201,"startup_ratio_x":0.85828,"ct_resolve_us":0.042669,"minimal_resolve_us":0.082222,"resolve_delta_us":-0.039554,"ct_apply_us":567.29521,"minimal_apply_us":565.105308,"apply_delta_us":6.41198,"command_us":58.433301},"status":"discard","description":"No-code confirmation of hoisted deferred setup callback","timestamp":1777130889104,"segment":13,"confidence":null,"iterationTokens":1256,"asi":{"hypothesis":"Confirm the module-local deferred setup callback improvement under 31-sample benchmark before stacking more setup closure changes.","rollback_reason":"No production change was made and delta_us reran much worse (-69.34us); first improvement is not confirmed. Apply guardrail also worsened to 6.41us.","next_action_hint":"Consider reverting hoisted deferred callback if another confirmation/revert probe shows it is noise or hurts apply."}}
{"run":87,"commit":"2045954","metric":-77.100049,"metrics":{"ct_startup_us":440.937305,"minimal_startup_us":517.631396,"startup_ratio_x":0.851836,"ct_resolve_us":0.056071,"minimal_resolve_us":0.1029,"resolve_delta_us":-0.046829,"ct_apply_us":577.716775,"minimal_apply_us":575.892605,"apply_delta_us":7.180732,"command_us":60.170801},"status":"discard","description":"Revert hoisted deferred setup callback back inline","timestamp":1777130922413,"segment":13,"confidence":null,"iterationTokens":1392,"asi":{"hypothesis":"Because no-code confirmation was poor, reverting the hoisted deferred setup callback may be neutral or better.","rollback_reason":"Primary delta_us worsened to -77.10us and apply_delta_us worsened to 7.18us, so the revert was not kept. Current code keeps the hoisted deferred callback despite weak confirmation.","next_action_hint":"Leave hoisted callback for now, but treat its speed signal as noisy; do not stack more closure-hoisting changes."}}
{"run":88,"commit":"2045954","metric":-63.506055,"metrics":{"ct_startup_us":424.379199,"minimal_startup_us":496.03335,"startup_ratio_x":0.855546,"ct_resolve_us":0.044852,"minimal_resolve_us":0.049071,"resolve_delta_us":-0.00422,"ct_apply_us":556.30656,"minimal_apply_us":556.283127,"apply_delta_us":7.424062,"command_us":60.016699},"status":"discard","description":"Explicit schema-field merge for default config","timestamp":1777130970057,"segment":13,"confidence":null,"iterationTokens":2199,"asi":{"hypothesis":"Replacing generic vim.tbl_deep_extend for default config with explicit documented-field assignment could reduce setup merge overhead while preserving public config schema.","rollback_reason":"Primary delta_us regressed badly to -63.51us and apply_delta_us worsened to 7.42us. Generic deep_extend is faster/safer in this context or noise strongly disfavors the rewrite.","next_action_hint":"Keep vim.tbl_deep_extend for default config. Do not pursue manual config merge without a broader redesign and tests for unknown/nil behavior."}}
{"run":89,"commit":"2045954","metric":-94.345752,"metrics":{"ct_startup_us":422.204053,"minimal_startup_us":509.385449,"startup_ratio_x":0.82885,"ct_resolve_us":0.04776,"minimal_resolve_us":0.075482,"resolve_delta_us":-0.027722,"ct_apply_us":579.859167,"minimal_apply_us":582.593748,"apply_delta_us":3.888752,"command_us":64.666504},"status":"discard","description":"Localize vim.deepcopy and vim.tbl_deep_extend in setup","timestamp":1777131016970,"segment":13,"confidence":null,"iterationTokens":1586,"asi":{"hypothesis":"Binding vim.deepcopy and vim.tbl_deep_extend to locals may reduce repeated global lookups in setup copy/merge.","rollback_reason":"Delta improvement versus segment baseline was small/noisy, worse than the prior hoisted-callback run, while command_us worsened sharply to 64.67us and apply_delta_us worsened to 3.89us.","next_action_hint":"Keep direct vim.deepcopy/vim.tbl_deep_extend calls. Avoid setup helper localization unless it delivers a repeated larger delta win without guardrail regressions."}}
{"run":90,"commit":"2045954","metric":-55.837598,"metrics":{"ct_startup_us":441.1625,"minimal_startup_us":505.810498,"startup_ratio_x":0.872189,"ct_resolve_us":0.038416,"minimal_resolve_us":0.050542,"resolve_delta_us":-0.012126,"ct_apply_us":565.249792,"minimal_apply_us":561.024063,"apply_delta_us":5.538752,"command_us":59.620996},"status":"discard","description":"Inline background validation comparisons","timestamp":1777131111962,"segment":13,"confidence":null,"iterationTokens":4492,"asi":{"hypothesis":"Inline comparisons for light/dark/system might avoid table lookup overhead in setup validation for default and schedule backgrounds.","rollback_reason":"Primary delta_us regressed badly to -55.84us and apply guardrail worsened. The lookup table is faster/clearer here.","next_action_hint":"Keep VALID_BACKGROUNDS table lookups. Do not inline background validation."}}
{"run":91,"commit":"2045954","metric":-82.743896,"metrics":{"ct_startup_us":437.829248,"minimal_startup_us":516.245947,"startup_ratio_x":0.848102,"ct_resolve_us":0.043774,"minimal_resolve_us":0.097336,"resolve_delta_us":-0.053563,"ct_apply_us":587.66156,"minimal_apply_us":583.799272,"apply_delta_us":3.294268,"command_us":62.479199},"status":"discard","description":"No-code stability check after hoisted deferred callback","timestamp":1777131147922,"segment":13,"confidence":null,"iterationTokens":1126,"asi":{"hypothesis":"Estimate current 31-sample noise after several weak/failed setup micro-optimizations.","rollback_reason":"No production change was made and delta_us remained worse than the original 31-sample baseline (-82.74us vs -92.01us), adding evidence that hoisted deferred callback may be noisy despite failed revert probe.","next_action_hint":"Run a focused revert of both weak kept changes (numeric validation loop and hoisted defer callback) together; if baseline code wins, keep the revert for maintainability."}}
{"run":92,"commit":"2045954","metric":-87.729297,"metrics":{"ct_startup_us":491.2229,"minimal_startup_us":575.741797,"startup_ratio_x":0.8532,"ct_resolve_us":0.054169,"minimal_resolve_us":0.09792,"resolve_delta_us":-0.043751,"ct_apply_us":588.7075,"minimal_apply_us":587.11563,"apply_delta_us":2.50844,"command_us":62.816699},"status":"discard","description":"Revert both weak kept setup changes together","timestamp":1777131184002,"segment":13,"confidence":null,"iterationTokens":1810,"asi":{"hypothesis":"Reverting both weak kept changes (numeric validation loop and hoisted deferred callback) may restore the cleaner 31-sample baseline if their apparent wins were noise.","rollback_reason":"Primary delta_us worsened to -87.73us compared with the 31-sample baseline -92.01us and the combined revert did not justify removing committed changes.","next_action_hint":"Keep both weak changes for now because revert probes are worse, but note confirmation remains noisy. Move to larger structural ideas or stop micro-opts."}}
{"type":"config","name":"Stable startup delta with 31 samples and 9 startup iterations","metricName":"delta_us","metricUnit":"µs","bestDirection":"lower"}
{"run":93,"commit":"579f10d","metric":-62.120334,"metrics":{"ct_startup_us":454.730414,"minimal_startup_us":523.170166,"startup_ratio_x":0.869183,"ct_resolve_us":0.046309,"minimal_resolve_us":0.070906,"resolve_delta_us":-0.024597,"ct_apply_us":590.42365,"minimal_apply_us":593.206355,"apply_delta_us":2.561667,"command_us":57.558398},"status":"keep","description":"Baseline startup delta with 31 samples and 9 startup iterations","timestamp":1777131282837,"segment":14,"confidence":null,"iterationTokens":106,"asi":{"hypothesis":"Increase startup iterations per sample from 5 to 9 to reduce startup noise for current startup-focused segment.","benchmark_change":"CT_BENCH_STARTUP_ITERS default changed from 5 to 9; samples remain 31 and workload unchanged.","baseline_delta_us":-62.120334,"guardrail_apply_delta_us":2.561667,"guardrail_command_us":57.558398,"next_action_hint":"Use this steadier startup baseline for final weak-change decisions; compare candidate changes against it rather than earlier noisier segments."}}
{"run":94,"commit":"1dd277a","metric":-88.67117,"metrics":{"ct_startup_us":405.686334,"minimal_startup_us":496.096083,"startup_ratio_x":0.817758,"ct_resolve_us":0.044749,"minimal_resolve_us":0.071497,"resolve_delta_us":-0.026748,"ct_apply_us":595.309062,"minimal_apply_us":604.072603,"apply_delta_us":-1.21531,"command_us":63.020801},"status":"keep","description":"Revert weak setup loop and deferred callback changes under 31x9 benchmark","timestamp":1777131338851,"segment":14,"confidence":null,"iterationTokens":1790,"asi":{"hypothesis":"With the steadier 31x9 startup benchmark, the two weak kept changes may show as noise; reverting both restores simpler code and may improve startup delta.","result":"delta_us improved strongly from -62.12us to -88.67us. apply_delta_us also improved to -1.22us. command_us worsened to 63.02us but remains near prior noise/guardrail levels.","tradeoff":"Reverts numeric validation loop back to idiomatic ipairs and inlines the deferred setup callback again, improving maintainability.","next_action_hint":"Keep this revert unless a no-code confirmation is catastrophically worse; do not reintroduce either weak change."}}
{"run":95,"commit":"26b1f53","metric":-95.202393,"metrics":{"ct_startup_us":438.021946,"minimal_startup_us":525.921332,"startup_ratio_x":0.832866,"ct_resolve_us":0.046156,"minimal_resolve_us":0.085407,"resolve_delta_us":-0.039251,"ct_apply_us":585.516458,"minimal_apply_us":583.56292,"apply_delta_us":-1.840728,"command_us":56.762695},"status":"keep","description":"No-code confirmation after reverting weak setup changes","timestamp":1777131379097,"segment":14,"confidence":null,"iterationTokens":1704,"asi":{"hypothesis":"Confirm the reverted weak setup changes under the steadier 31x9 benchmark.","result":"No-code confirmation improved delta_us further to -95.20us. Apply stayed favorable at -1.84us and command_us returned to 56.76us, removing the prior command guardrail concern.","next_action_hint":"Treat the revert as confirmed. Continue only with larger structural ideas; avoid revisiting numeric validation loops or hoisted deferred callbacks."}}
{"run":96,"commit":"26b1f53","metric":-63.777669,"metrics":{"ct_startup_us":455.553141,"minimal_startup_us":511.490804,"startup_ratio_x":0.890638,"ct_resolve_us":0.080428,"minimal_resolve_us":0.154969,"resolve_delta_us":-0.074542,"ct_apply_us":575.324893,"minimal_apply_us":568.840833,"apply_delta_us":7.008228,"command_us":59.125391},"status":"discard","description":"Split rare enable/disable/reload actions out of core","timestamp":1777131486219,"segment":14,"confidence":null,"iterationTokens":8019,"asi":{"hypothesis":"Moving rare command actions into actions.lua might shrink core parse/setup path while preserving behavior through private hooks.","rollback_reason":"Primary delta_us fell back to -63.78us versus the confirmed current -95.20us, apply_delta_us worsened to 7.01us, and the private hook module added significant complexity. Not keepable.","next_action_hint":"Prune broader action split idea unless a much cleaner API boundary is designed; wrappers/private hook tables are too costly and complex."}}
{"run":97,"commit":"26b1f53","metric":-86.059082,"metrics":{"ct_startup_us":407.818278,"minimal_startup_us":488.107558,"startup_ratio_x":0.835509,"ct_resolve_us":0.0548,"minimal_resolve_us":0.160373,"resolve_delta_us":-0.105573,"ct_apply_us":558.277815,"minimal_apply_us":557.528228,"apply_delta_us":2.76896,"command_us":59.837402},"status":"discard","description":"Replace timers table with separate schedule and poll timer locals","timestamp":1777131651528,"segment":14,"confidence":null,"iterationTokens":17656,"asi":{"hypothesis":"Separate _schedule_timer and _poll_timer locals may avoid a module-load table allocation and runtime _timers table lookups without changing timer behavior.","rollback_reason":"Primary delta_us was worse than the current confirmed HEAD signal (-86.06us vs -95.20us) and apply/command guardrails worsened versus confirmation. Code was not worth keeping despite being structurally simple.","next_action_hint":"Keep the _timers table. Avoid module-load allocation micro-opts unless they repeatedly beat the confirmed 31x9 result."}}
{"run":98,"commit":"26b1f53","metric":-67.405301,"metrics":{"ct_startup_us":431.133165,"minimal_startup_us":507.45836,"startup_ratio_x":0.849593,"ct_resolve_us":0.039264,"minimal_resolve_us":0.053324,"resolve_delta_us":-0.014061,"ct_apply_us":570.74354,"minimal_apply_us":570.26104,"apply_delta_us":-1.120208,"command_us":59.945898},"status":"discard","description":"No-code stability check after pruning exhausted ideas","timestamp":1777131757192,"segment":14,"confidence":null,"iterationTokens":5024,"asi":{"hypothesis":"With obvious ideas exhausted, rerun the current HEAD to estimate 31x9 noise and avoid chasing stale micro-optimizations.","rollback_reason":"No production change was made and delta_us reran worse than the prior confirmed HEAD result (-67.41us vs -95.20us), showing substantial residual noise. Autoresearch docs remain preserved.","next_action_hint":"Only keep future changes with repeated large improvements; consider benchmark/reporting improvements rather than code micro-opts."}}
{"run":99,"commit":"26b1f53","metric":0,"metrics":{"ct_startup_us":0,"minimal_startup_us":0,"startup_ratio_x":0,"ct_resolve_us":0,"minimal_resolve_us":0,"resolve_delta_us":0,"ct_apply_us":0,"minimal_apply_us":0,"apply_delta_us":0,"command_us":0},"status":"crash","description":"Add paired-delta spread metrics to benchmark output","timestamp":1777131837326,"segment":14,"confidence":null,"iterationTokens":3278,"asi":{"hypothesis":"Report startup/apply paired-delta p25/p75/IQR to quantify noise before keeping more sub-10us changes.","rollback_reason":"Benchmark harness crashed because collect_apply_pair still returned only three values, leaving apply_delta_p75_us nil during IQR calculation.","next_action_hint":"Reapply diagnostics carefully by updating both collect_startup_pair and collect_apply_pair return paths."}}
{"run":100,"commit":"109eeb7","metric":-85.984972,"metrics":{"delta_p25_us":-109.082248,"delta_p75_us":-71.629584,"delta_iqr_us":37.452664,"ct_startup_us":412.605414,"minimal_startup_us":499.108805,"startup_ratio_x":0.826684,"ct_resolve_us":0.052154,"minimal_resolve_us":0.094313,"resolve_delta_us":-0.042159,"ct_apply_us":567.027185,"minimal_apply_us":570.44677,"apply_delta_us":-0.277292,"apply_delta_p25_us":-7.909272,"apply_delta_p75_us":11.635518,"apply_delta_iqr_us":19.54479,"command_us":62.916602},"status":"keep","description":"Report paired startup/apply delta spread diagnostics","timestamp":1777131902664,"segment":14,"confidence":null,"iterationTokens":5045,"asi":{"hypothesis":"Adding p25/p75/IQR for paired startup and apply deltas will quantify residual benchmark noise and reduce overfitting to sub-10us single-run changes.","result":"Benchmark now reports delta_iqr_us=37.45 and apply_delta_iqr_us=19.54, confirming that tiny micro-optimizations are below noise. Primary delta_us remains faster than minimal at -85.98us.","benchmark_change":"No production code changed; benchmark output gained startup/apply paired-delta spread metrics. A previous crash attempt was fixed by updating both paired collectors.","next_action_hint":"Use IQR as a guardrail: avoid keeping future code changes unless improvement is repeated and large relative to spread, or the change improves maintainability."}}
{"run":101,"commit":"60e7964","metric":-93.819417,"metrics":{"delta_p25_us":-107.630697,"delta_p75_us":-59.721137,"delta_iqr_us":47.909559,"ct_startup_us":431.957194,"minimal_startup_us":529.22564,"startup_ratio_x":0.816206,"ct_resolve_us":0.04557,"minimal_resolve_us":0.065448,"resolve_delta_us":-0.019879,"ct_apply_us":564.748647,"minimal_apply_us":562.021562,"apply_delta_us":4.416145,"apply_delta_p25_us":-1.644375,"apply_delta_p75_us":10.29948,"apply_delta_iqr_us":11.943855,"command_us":58.099902},"status":"keep","description":"No-code confirmation with paired-delta spread diagnostics","timestamp":1777131945734,"segment":14,"confidence":null,"iterationTokens":1919,"asi":{"hypothesis":"Confirm current HEAD after adding spread diagnostics and capture noise envelope for future decisions.","result":"delta_us reran at -93.82us, close to the prior confirmed -95.20us. delta_iqr_us remained large at 47.91us, so future code changes need large/repeated wins.","next_action_hint":"Do not chase micro-optimizations. Only try changes that remove meaningful work from core load/setup or improve benchmark quality."}}
{"run":102,"commit":"19c97ac","metric":-90.63425,"metrics":{"delta_p25_us":-100.883084,"delta_p75_us":-53.602892,"delta_iqr_us":47.280192,"delta_empty_us":-94.111003,"delta_two_entry_us":-80.38878,"delta_disabled_us":-88.162218,"delta_hourly_us":-42.069878,"ct_startup_us":400.783583,"minimal_startup_us":490.511637,"startup_ratio_x":0.817073,"ct_resolve_us":0.053089,"minimal_resolve_us":0.090736,"resolve_delta_us":-0.037647,"ct_apply_us":560.89667,"minimal_apply_us":564.20979,"apply_delta_us":-0.05417,"apply_delta_p25_us":-5.93031,"apply_delta_p75_us":7.626877,"apply_delta_iqr_us":13.557188,"command_us":59.337402},"status":"keep","description":"Report per-scenario startup delta diagnostics","timestamp":1777132176216,"segment":14,"confidence":null,"iterationTokens":16701,"asi":{"hypothesis":"Adding per-scenario startup deltas will show whether remaining startup variance or regressions are concentrated in specific representative configs without changing the aggregate primary metric.","result":"Benchmark now reports scenario deltas. First run: empty=-94.11us, two_entry=-80.39us, disabled=-88.16us, hourly=-42.07us. Hourly schedule is the weakest parity scenario but still faster than the minimal reference.","benchmark_change":"Added diagnostic-only per-scenario startup delta metrics; primary delta_us calculation and workload are unchanged.","next_action_hint":"If any future structural work is considered, target broad core-load/setup cost rather than schedule micro-opts: hourly is weakest, but schedule-specific experiments already regressed and are noise-prone."}}
{"run":103,"commit":"2f6c146","metric":-84.125163,"metrics":{"delta_p25_us":-101.44911,"delta_p75_us":-68.475694,"delta_iqr_us":32.973416,"delta_empty_us":-96.837457,"delta_two_entry_us":-84.157552,"delta_disabled_us":-88.879774,"delta_hourly_us":-61.323785,"ct_startup_us":405.203749,"minimal_startup_us":493.716363,"startup_ratio_x":0.820722,"ct_resolve_us":0.048868,"minimal_resolve_us":0.091032,"resolve_delta_us":-0.042164,"ct_apply_us":573.879063,"minimal_apply_us":575.141772,"apply_delta_us":0.929587,"apply_delta_p25_us":-8.726458,"apply_delta_p75_us":15.537812,"apply_delta_iqr_us":24.26427,"apply_delta_empty_us":3.605,"apply_delta_two_entry_us":7.48249,"apply_delta_disabled_us":-1.27209,"apply_delta_hourly_us":4.99333,"command_us":57.916504},"status":"keep","description":"Report per-scenario apply delta diagnostics","timestamp":1777132297232,"segment":14,"confidence":null,"iterationTokens":16701,"asi":{"hypothesis":"Per-scenario apply deltas complement startup scenario diagnostics and show whether apply parity problems are scenario-specific without changing the primary metric.","result":"Benchmark now reports apply scenario deltas. First run: empty=3.61us, two_entry=7.48us, disabled=-1.27us, hourly=4.99us. All are within apply IQR=24.26us, so apply remains parity/noise-limited.","benchmark_change":"Added diagnostic-only per-scenario apply delta metrics; primary delta_us calculation and workload are unchanged.","next_action_hint":"Avoid scenario-specific apply optimizations; observed per-scenario apply differences are inside measured noise."}}
