{"run":22,"commit":"a05fdba","metric":-16.010697,"metrics":{"delta_us":-71.833659,"ct_startup_us":385.805339,"minimal_startup_us":457.638997,"startup_ratio_x":0.843034,"ct_resolve_us":0.031444,"minimal_resolve_us":0.049484,"resolve_delta_us":-0.01804,"ct_apply_us":540.520137,"minimal_apply_us":556.530833,"command_us":59.25},"status":"keep","description":"Use unconditional vim.schedule again for apply after stable benchmark showed lower apply delta","timestamp":1777126697560,"segment":2,"confidence":null,"iterationTokens":1253,"asi":{"hypothesis":"The prior synchronous-safe apply win may have been noise; under the stabler apply benchmark, unconditional scheduling may be as fast or faster while preserving old async semantics.","result":"apply_delta_us improved from stable baseline +18.80us to -16.01us; startup guardrail remains faster than minimal.","tradeoff":"This reverts the public timing semantics back to always-scheduled apply, reducing behavior-change risk from the prior experiment.","next_action_hint":"Keep stable benchmark settings. Re-test scalar resolution separately if needed; focus on structural apply work, not scheduling micro-changes."}}
{"run":23,"commit":"a05fdba","metric":15.90583,"metrics":{"delta_us":-72.902995,"ct_startup_us":364.041667,"minimal_startup_us":436.944661,"startup_ratio_x":0.833153,"ct_resolve_us":0.041397,"minimal_resolve_us":0.090056,"resolve_delta_us":-0.04866,"ct_apply_us":570.06125,"minimal_apply_us":554.15542,"command_us":58.625},"status":"discard","description":"Inline unconditional vim.schedule calls and remove apply helper","timestamp":1777126733144,"segment":2,"confidence":null,"iterationTokens":1967,"asi":{"hypothesis":"After reverting to unconditional scheduling, removing the helper might avoid one Lua call and simplify apply.","rollback_reason":"Primary apply_delta_us regressed from -16.01us to +15.91us; helper form benchmarks better under stable settings.","next_action_hint":"Keep the small apply helper even though it only wraps vim.schedule."}}
{"run":24,"commit":"a05fdba","metric":-1.69778,"metrics":{"delta_us":-127.722331,"ct_startup_us":372.777669,"minimal_startup_us":500.5,"startup_ratio_x":0.744811,"ct_resolve_us":0.041974,"minimal_resolve_us":0.048392,"resolve_delta_us":-0.006418,"ct_apply_us":560.598333,"minimal_apply_us":562.296113,"command_us":58.666992},"status":"discard","description":"No-code confirmation rerun of stable apply best state","timestamp":1777126771403,"segment":2,"confidence":null,"iterationTokens":829,"asi":{"hypothesis":"Confirm stable apply best after reverting to unconditional scheduling.","rollback_reason":"No production change was made and apply_delta_us reran worse than the current best (-16.01us), though still better than stable baseline.","next_action_hint":"Stable apply benchmark still has noise around parity; treat sub-10us changes cautiously."}}
{"type":"config","name":"Match minimal colorscheme switcher paired apply speed","metricName":"apply_delta_us","metricUnit":"µs","bestDirection":"lower"}
{"run":25,"commit":"cde5ef0","metric":-0.05514,"metrics":{"delta_us":-115.236328,"ct_startup_us":343,"minimal_startup_us":458.236328,"startup_ratio_x":0.748522,"ct_resolve_us":0.038628,"minimal_resolve_us":0.049985,"resolve_delta_us":-0.011357,"ct_apply_us":574.310973,"minimal_apply_us":577.245417,"command_us":67.625},"status":"keep","description":"Baseline paired apply benchmark using per-sample Colorful Times minus minimal deltas","timestamp":1777126840199,"segment":3,"confidence":null,"iterationTokens":104,"asi":{"hypothesis":"Paired apply deltas should reduce noise from subtracting independent medians and better show whether Colorful Times matches the minimal switcher.","benchmark_change":"Workload changed again; apply_delta_us now uses the median of paired per-sample deltas. Previous stable segment best is not directly comparable.","baseline_apply_delta_us":-0.05514,"startup_guardrail_delta_us":-115.236328,"next_action_hint":"With paired apply delta essentially at parity, focus only on structural changes or stop apply micro-tuning unless a clear bottleneck appears."}}
{"run":26,"commit":"cde5ef0","metric":3.585003,"metrics":{"delta_us":-49.944661,"ct_startup_us":405.083333,"minimal_startup_us":455.027995,"startup_ratio_x":0.890238,"ct_resolve_us":0.025891,"minimal_resolve_us":0.051098,"resolve_delta_us":-0.025207,"ct_apply_us":557.734307,"minimal_apply_us":555.76389,"command_us":75.291992},"status":"discard","description":"Retry empty-schedule fast path under paired apply benchmark","timestamp":1777126876195,"segment":3,"confidence":null,"iterationTokens":1517,"asi":{"hypothesis":"Paired apply benchmark might show a real win from resolving empty schedules directly to defaults without loading schedule.lua.","rollback_reason":"Primary apply_delta_us worsened from -0.055us to +3.585us, so the fast path still does not help the active metric.","next_action_hint":"Do not retry the empty-schedule fast path for apply unless the benchmark is split into explicit empty-schedule and non-empty-schedule workloads."}}
{"run":27,"commit":"cde5ef0","metric":8.637777,"metrics":{"delta_us":-97.416016,"ct_startup_us":378.250326,"minimal_startup_us":475.666341,"startup_ratio_x":0.795201,"ct_resolve_us":0.026399,"minimal_resolve_us":0.049895,"resolve_delta_us":-0.023496,"ct_apply_us":572.550277,"minimal_apply_us":562.270553,"command_us":74.958008},"status":"discard","description":"A/B check table-based resolve context in apply and resolve_theme under paired benchmark","timestamp":1777126911393,"segment":3,"confidence":null,"iterationTokens":1770,"asi":{"hypothesis":"Confirm scalar resolution is still useful under the paired apply benchmark by reverting hot apply/resolve calls to table-based context resolution.","rollback_reason":"Primary apply_delta_us worsened from -0.055us to +8.64us; scalar resolution remains beneficial.","next_action_hint":"Keep resolve_theme_parts for hot paths."}}
{"type":"config","name":"Match minimal switcher with hourly schedule coverage","metricName":"apply_delta_us","metricUnit":"µs","bestDirection":"lower"}
{"run":28,"commit":"a0fb918","metric":3.075315,"metrics":{"delta_us":-91.343506,"ct_startup_us":384.28125,"minimal_startup_us":475.624756,"startup_ratio_x":0.80795,"ct_resolve_us":0.050047,"minimal_resolve_us":0.090628,"resolve_delta_us":-0.040581,"ct_apply_us":572.598752,"minimal_apply_us":574.366665,"command_us":68.416992},"status":"keep","description":"Baseline after adding representative 24-entry hourly schedule scenario","timestamp":1777127012249,"segment":4,"confidence":null,"iterationTokens":103,"asi":{"hypothesis":"Broaden workload with a representative 24-entry hourly schedule to reduce overfitting to tiny schedules while keeping the minimal reference unchanged.","benchmark_change":"Workload changed; experiment reinitialized. Primary is paired apply_delta_us across four scenarios: empty schedule, two-entry day/night, disabled one-entry, and 24-entry hourly schedule.","baseline_apply_delta_us":3.075315,"startup_guardrail_delta_us":-91.343506,"next_action_hint":"Large-schedule scenario may expose schedule lookup/preprocess costs. Explore schedule runtime logic only if it improves paired apply without hurting startup parity."}}
{"run":29,"commit":"a0fb918","metric":9.735313,"metrics":{"delta_us":-94.21875,"ct_startup_us":406.833496,"minimal_startup_us":501.052246,"startup_ratio_x":0.811958,"ct_resolve_us":0.059907,"minimal_resolve_us":0.099921,"resolve_delta_us":-0.040014,"ct_apply_us":577.022295,"minimal_apply_us":572.565938,"command_us":60.666016},"status":"discard","description":"Inline active-entry range check and use numeric loop in schedule.get_active_entry","timestamp":1777127055335,"segment":4,"confidence":null,"iterationTokens":4853,"asi":{"hypothesis":"Large hourly schedules pay one helper call per entry during active lookup; inlining range checks and using a numeric loop should reduce apply/resolve cost.","rollback_reason":"Primary apply_delta_us worsened from 3.08us to 9.74us; LuaJIT/Neovim path did not benefit from the inline numeric-loop rewrite.","next_action_hint":"Keep schedule.get_active_entry helper structure. Do not retry this exact inline loop optimization."}}
{"run":30,"commit":"a0fb918","metric":10.08042,"metrics":{"delta_us":52.405762,"ct_startup_us":541.260254,"minimal_startup_us":488.854492,"startup_ratio_x":1.107201,"ct_resolve_us":0.043752,"minimal_resolve_us":0.078508,"resolve_delta_us":-0.034756,"ct_apply_us":579.15125,"minimal_apply_us":566.29594,"command_us":59.083984},"status":"discard","description":"Precompute parsed schedule during setup when persistence is disabled","timestamp":1777127108251,"segment":4,"confidence":null,"iterationTokens":2920,"asi":{"hypothesis":"Moving schedule preprocessing from first apply into setup for persist=false configs may reduce apply_delta_us for non-empty and hourly schedules while keeping behavior unchanged.","rollback_reason":"Primary apply_delta_us worsened from 3.08us to 10.08us and startup guardrail regressed past the minimal switcher (delta_us=52.41us, ratio=1.11).","next_action_hint":"Do not precompute parsed schedules during setup under this target; lazy preprocessing preserves startup parity and does not hurt paired apply enough to justify the tradeoff."}}
{"run":31,"commit":"a0fb918","metric":5.34625,"metrics":{"delta_us":-52.1875,"ct_startup_us":461.072754,"minimal_startup_us":513.260254,"startup_ratio_x":0.898322,"ct_resolve_us":0.046099,"minimal_resolve_us":0.073163,"resolve_delta_us":-0.027064,"ct_apply_us":576.943022,"minimal_apply_us":567.4699,"command_us":64.25},"status":"discard","description":"Use direct array appends instead of table.insert in schedule.preprocess","timestamp":1777127161431,"segment":4,"confidence":null,"iterationTokens":3458,"asi":{"hypothesis":"schedule.preprocess runs on first apply for non-empty schedules; direct array appends should be cheaper than table.insert while preserving behavior.","rollback_reason":"Primary apply_delta_us worsened from 3.08us to 5.35us; direct appends did not help this workload.","next_action_hint":"Keep table.insert in schedule.preprocess. Avoid retrying pure append micro-optimization."}}
{"run":32,"commit":"a0fb918","metric":8.048337,"metrics":{"delta_us":-93.583496,"ct_startup_us":382.760498,"minimal_startup_us":476.343994,"startup_ratio_x":0.803538,"ct_resolve_us":0.047186,"minimal_resolve_us":0.064989,"resolve_delta_us":-0.017802,"ct_apply_us":557.583542,"minimal_apply_us":552.21073,"command_us":57.75},"status":"discard","description":"Cache active schedule entry for non-overlapping schedules","timestamp":1777127256711,"segment":4,"confidence":null,"iterationTokens":4805,"asi":{"hypothesis":"Common schedules are non-overlapping; detecting that in preprocess and caching the active entry should reduce repeated active lookup during apply loops without changing overlapping-schedule semantics.","rollback_reason":"Primary apply_delta_us worsened from 3.08us to 8.05us. Non-overlap detection/preprocess overhead and cache checks outweighed lookup savings in this workload.","next_action_hint":"Do not add active-entry caching unless a separate real-world profile shows repeated apply calls within one schedule interval dominate."}}
{"type":"config","name":"Reduce command registration overhead after switcher parity","metricName":"command_us","metricUnit":"µs","bestDirection":"lower"}
{"run":33,"commit":"408cec8","metric":80.75,"metrics":{"delta_us":-73.17749,"ct_startup_us":395.937256,"minimal_startup_us":469.114746,"startup_ratio_x":0.844009,"ct_resolve_us":0.048429,"minimal_resolve_us":0.076406,"resolve_delta_us":-0.027977,"ct_apply_us":578.679585,"minimal_apply_us":570.681355,"apply_delta_us":6.315417},"status":"keep","description":"Baseline command registration cost after setup/apply parity and hourly schedule benchmark broadened","timestamp":1777127314497,"segment":5,"confidence":null,"iterationTokens":102,"asi":{"hypothesis":"After setup and apply reached parity with the minimal switcher, plugin command registration is the remaining measured startup-adjacent cost worth checking.","benchmark_change":"Metric changed to command_us; apply_delta_us and delta_us are guardrails only.","baseline_command_us":80.75,"guardrail_apply_delta_us":6.315417,"guardrail_delta_us":-73.17749,"next_action_hint":"Explore plugin/colorful-times.lua command registration structure. Avoid removing commands or changing public command behavior."}}
{"run":34,"commit":"8c58e2c","metric":57.041992,"metrics":{"delta_us":-97.916504,"ct_startup_us":371.968506,"minimal_startup_us":469.88501,"startup_ratio_x":0.791616,"ct_resolve_us":0.048383,"minimal_resolve_us":0.089438,"resolve_delta_us":-0.041055,"ct_apply_us":578.76052,"minimal_apply_us":565.546877,"apply_delta_us":5.799377},"status":"keep","description":"Cache nvim_create_user_command local while registering plugin commands","timestamp":1777127349335,"segment":5,"confidence":null,"iterationTokens":1980,"asi":{"hypothesis":"Command registration calls the same Vim API function six times; localizing it should reduce plugin/ startup overhead without changing public commands.","result":"command_us improved from 80.75us to 57.04us; setup/apply guardrails remained within parity targets.","tradeoff":"Only plugin/colorful-times.lua changes; no behavior or command list changes.","next_action_hint":"Next try reducing closure duplication in command callbacks, but avoid removing commands or requiring core at plugin load."}}
{"run":35,"commit":"8c58e2c","metric":61.291992,"metrics":{"delta_us":-42.458252,"ct_startup_us":416.385498,"minimal_startup_us":458.84375,"startup_ratio_x":0.907467,"ct_resolve_us":0.044334,"minimal_resolve_us":0.08109,"resolve_delta_us":-0.036756,"ct_apply_us":566.458542,"minimal_apply_us":558.235627,"apply_delta_us":6.891248},"status":"discard","description":"Generate common command callbacks through a helper function","timestamp":1777127397334,"segment":5,"confidence":5.578354823529412,"iterationTokens":1848,"asi":{"hypothesis":"A helper that creates callbacks for common commands might reduce plugin file size and repeated closure bodies during command registration.","rollback_reason":"Primary command_us worsened from 57.04us to 61.29us; helper indirection/calls outweighed any reduction in repeated callback bodies.","next_action_hint":"Keep explicit callbacks. Further command optimization should target opts table allocation or status callback size, not helper-generated callbacks."}}
{"run":36,"commit":"8c58e2c","metric":75.583008,"metrics":{"delta_us":-101.010498,"ct_startup_us":385.854248,"minimal_startup_us":486.864746,"startup_ratio_x":0.792529,"ct_resolve_us":0.048134,"minimal_resolve_us":0.089171,"resolve_delta_us":-0.041037,"ct_apply_us":581.770835,"minimal_apply_us":572.050105,"apply_delta_us":5.374272},"status":"discard","description":"Move ColorfulTimesStatus formatting into a lazily required status module","timestamp":1777127456921,"segment":5,"confidence":2.557358021804198,"iterationTokens":2428,"asi":{"hypothesis":"Status command has the largest callback body in plugin/colorful-times.lua; moving formatting to a lazy module should shrink plugin sourcing and command registration cost.","rollback_reason":"Primary command_us worsened from 57.04us to 75.58us, likely because the extra require target/closure did not reduce command creation overhead enough and the new file is irrelevant until execution.","next_action_hint":"Keep status formatting inline in plugin. Command registration cost is dominated by nvim_create_user_command calls and noise, not callback body size."}}
{"run":37,"commit":"8c58e2c","metric":63.958984,"metrics":{"delta_us":-83.052002,"ct_startup_us":406.854248,"minimal_startup_us":489.90625,"startup_ratio_x":0.830474,"ct_resolve_us":0.054727,"minimal_resolve_us":0.071077,"resolve_delta_us":-0.016351,"ct_apply_us":591.8475,"minimal_apply_us":587.629998,"apply_delta_us":2.756255},"status":"discard","description":"Localize require in plugin command callbacks","timestamp":1777127509723,"segment":5,"confidence":3.4275025907215158,"iterationTokens":1517,"asi":{"hypothesis":"Making require an upvalue for command callbacks might reduce closure/global lookup overhead when registering commands.","rollback_reason":"Primary command_us worsened from 57.04us to 63.96us; localizing require only adds plugin-load work and does not help registration.","next_action_hint":"Do not localize callback-only globals in plugin/colorful-times.lua."}}
{"type":"config","name":"Reduce stable command registration overhead","metricName":"command_us","metricUnit":"µs","bestDirection":"lower"}
{"run":38,"commit":"a7d6e4f","metric":56.833203,"metrics":{"delta_us":-59.90625,"ct_startup_us":401.114502,"minimal_startup_us":461.020752,"startup_ratio_x":0.870057,"ct_resolve_us":0.0487,"minimal_resolve_us":0.077008,"resolve_delta_us":-0.028308,"ct_apply_us":562.144792,"minimal_apply_us":553.746145,"apply_delta_us":7.227603},"status":"keep","description":"Baseline stable command benchmark averaging ten registration cycles per sample","timestamp":1777127580826,"segment":6,"confidence":null,"iterationTokens":99,"asi":{"hypothesis":"Average command_us across 10 command registration/delete cycles per sample to reduce noise before further command micro-optimizations.","benchmark_change":"Metric implementation changed but still measures plugin/colorful-times.lua command registration cost; experiment reinitialized.","baseline_command_us":56.833203,"guardrail_apply_delta_us":7.227603,"guardrail_delta_us":-59.90625,"next_action_hint":"Retest command registration structure changes under stable command benchmark before keeping or discarding."}}
{"run":39,"commit":"a7d6e4f","metric":60.354297,"metrics":{"delta_us":-87.208008,"ct_startup_us":426.697998,"minimal_startup_us":513.906006,"startup_ratio_x":0.830304,"ct_resolve_us":0.046052,"minimal_resolve_us":0.074835,"resolve_delta_us":-0.028784,"ct_apply_us":565.45302,"minimal_apply_us":558.521355,"apply_delta_us":11.426355},"status":"discard","description":"Retest generated command callbacks under stable command benchmark","timestamp":1777127617437,"segment":6,"confidence":null,"iterationTokens":1674,"asi":{"hypothesis":"The callback helper might perform differently under the stabilized command benchmark averaging ten command registration cycles per sample.","rollback_reason":"Primary command_us worsened from 56.83us to 60.35us; explicit callbacks remain faster and simpler.","next_action_hint":"Do not retry helper-generated command callbacks."}}
{"run":40,"commit":"a7d6e4f","metric":58.816406,"metrics":{"delta_us":-82.9375,"ct_startup_us":407.854004,"minimal_startup_us":490.791504,"startup_ratio_x":0.831013,"ct_resolve_us":0.058848,"minimal_resolve_us":0.103084,"resolve_delta_us":-0.044235,"ct_apply_us":573.03677,"minimal_apply_us":568.220625,"apply_delta_us":3.42104},"status":"discard","description":"Remove redundant explicit core require from command callbacks","timestamp":1777127690920,"segment":6,"confidence":null,"iterationTokens":2339,"asi":{"hypothesis":"Command callbacks can rely on the public module lazy loader to require core, making explicit require('colorful-times.core') redundant and shrinking callback bodies.","rollback_reason":"Primary command_us worsened from 56.83us to 58.82us; smaller callback bodies did not improve registration cost under the stable benchmark.","next_action_hint":"Keep explicit core requires in callbacks for clarity and avoid retrying callback-body-only reductions."}}
{"run":41,"commit":"a7d6e4f","metric":59.4375,"metrics":{"delta_us":-83.781006,"ct_startup_us":392.96875,"minimal_startup_us":476.749756,"startup_ratio_x":0.824266,"ct_resolve_us":0.046053,"minimal_resolve_us":0.075496,"resolve_delta_us":-0.029443,"ct_apply_us":571.247813,"minimal_apply_us":564.887605,"apply_delta_us":3.037395},"status":"discard","description":"Reuse one mutable command opts table for user command descriptions","timestamp":1777127738496,"segment":6,"confidence":null,"iterationTokens":2339,"asi":{"hypothesis":"Reusing one opts table while changing desc before each nvim_create_user_command call may reduce table allocations during plugin sourcing while preserving descriptions if Neovim copies opts immediately.","rollback_reason":"Primary command_us worsened from 56.83us to 59.44us and the mutable opts pattern is less clear/riskier than literals.","next_action_hint":"Keep separate opts table literals for command descriptions."}}
{"run":42,"commit":"a7d6e4f","metric":58.591699,"metrics":{"delta_us":-75.302002,"ct_startup_us":395.3125,"minimal_startup_us":470.614502,"startup_ratio_x":0.839992,"ct_resolve_us":0.04503,"minimal_resolve_us":0.05561,"resolve_delta_us":-0.010581,"ct_apply_us":562.311355,"minimal_apply_us":555.108748,"apply_delta_us":8.909167},"status":"discard","description":"No-code confirmation rerun of stable command best state","timestamp":1777127771658,"segment":6,"confidence":null,"iterationTokens":1368,"asi":{"hypothesis":"Confirm stable command best before switching away from command micro-optimization.","rollback_reason":"No production change was made and command_us reran worse than the best 56.83us; current command best remains plausible but near microbenchmark noise.","next_action_hint":"Command registration path appears exhausted. Prefer returning to broader setup/apply guardrails or finalizing rather than chasing sub-2us command noise."}}
{"type":"config","name":"Revisit startup delta with hourly schedule coverage","metricName":"delta_us","metricUnit":"µs","bestDirection":"lower"}
